id,name,designer,publisher,artist,yearpublished,minplayers,maxplayers,playingtime,minplaytime,maxplaytime,age,usersrated,average,bayesaverage,rank,rank_wg,numcomments,numweights,averageweight,stddev,median,owned,trading,wanting,wishing,userrating,image,category,mechanic,comment,1player,2player,3player,4player,5player,6player,7player,8player,9player,10player,11player,12player,13player,14player,15player,16player,17player,18player,19player,20player,description,exp,basegame,basegame_name,reimplement,reimplement_name,reimplemented,reimplemented_name,contains,contains_name,iscontained,iscontained_name,integration,integration_name,accessories,accessories_name,numplays,price,userweight,wishpriority,expansions,domain,family,age_poll,name_others,comments_GL,thumbs_GL,sold_GL,price_GL,currency_GL,user_GL,tags,tags_user
226840,Star Wars: Rebellion - Rise of the Empire,Corey Konieczka,Fantasy Flight Games,Justin Adams,2017,2,4,240,180,240,14,4843,8.86,7.74,0,0,939,91,3.69,1.13,0,19099,94,292,1469,,C:\Users\thoma\Downloads\bgg1toolu\img\226840.jpg,"Expansion for Base-game, Movies / TV / Radio theme, Science Fiction, Wargame","Area Majority / Influence, Area Movement, Dice Rolling, Hand Management, Team-Based Game",,N,B,P,P,N,N,N,N,N,N,N,N,N,N,N,N,N,N,N,N,"Description from the publisher:""Our Rebellion is all that remains to push back the Empire. We think you may be able to help us.""     -Mon MothmaNew leaders. New missions. New tactic cards that lead to more fully cinematic combats... Rise of the Empire is an expansion for Star Wars: Rebellion inspired largely by the movie Rogue One: A Star Wars Story. And just as the movie provided new insight into the Galactic Civil War presented in the original Star Wars trilogy, Rise of the Empire adds new depth and...",Y,187645,Star Wars: Rebellion,,,,,,,,,,,"267463, 334032, 387375, 201256, 287907, 342723, 348614","Star Wars: Rebellion - Folded Space Insert, Star Wars: Rebellion - Laserox Rebell Organizer, Star Wars: Rebellion - Meeple Realty Insert, Star Wars: Rebellion - Quick-Start Insert, Star Wars: Rebellion - Rise of the Empire - Foam Tray, Star Wars: Rebellion - The Dicetroyers Organizer, Star Wars: Rebellion - The GiftForge Insert",0,32.82,0,0,,Thematic Games,"Components: Miniatures, Movies: Star Wars",12.73,"Star Wars: Lázadás - A Birodalom Felemelkedése, Star Wars: Rebelia - Imperium u władzy, Star Wars: Rebellion - A Ascensão do Império, Star Wars: Rebellion - Aufstieg des Imperiums, Star Wars: Rebellion - El auge del Imperio, Star Wars: Rebellion - L'Ascesa dell'Impero, Star Wars: Rébellion - L'Avènement de l'Empire, Звёздные Войны: Восстание - Рассвет Империи, 스타워즈: 리벨리온 - 제국의 부상",,,,,,,,
170216,Blood Rage,Eric M. Lang,Cool Mini Or Not,Henning Ludvigsen,2015,2,4,90,60,90,14,49286,7.91,7.74,57,0,7279,1603,2.88,1.42,0,59065,522,1443,13715,,C:\Users\thoma\Downloads\bgg1toolu\img\170216.jpg,"Fantasy, Fighting, Miniatures, Mythology","Action Points, Area Majority / Influence, Area Movement, Card Play Conflict Resolution, Closed Drafting, Hand Management, Map Reduction, Memory, Open Drafting, Simultaneous Action Selection, Take That, Turn Order: Progressive",,N,P,R,B,N,N,N,N,N,N,N,N,N,N,N,N,N,N,N,N,"""Life is Battle; Battle is Glory; Glory is ALL""In Blood Rage, players control the warriors, leader, and ship of their own Viking clan. Ragnarök has come and it's the end of the world! It's the Vikings' last chance to go down in a blaze of glory and secure their places in Valhalla at Odin's side! As a Viking you can pursue one of many pathways to glory. You can: invade and pillage the land for its rewards; crush your opponents in battle: fulfill quests: increase your clan's stats: or even die gloriousl...",N,0,,23985,Midgard,,,,,,,,,"338416, 359012, 382059, 188500, 238243, 299823, 299822, 309359, 309597, 287070, 340934, 437719, 319443, 299920, 348606, 271761","Blood Rage: Saim Lab Insert, Blood Rage: 3D Clan Tokens, Blood Rage: 3D First Player Token, Blood Rage: Acrylic Playermat Overlay, Blood Rage: Broken Token Organizer, Blood Rage: Cardboard Age Track & Valhalla Tiles, Blood Rage: Cardboard Clan Dashboards, Blood Rage: e-Raptor Insert, Blood Rage: e-Raptor Organizer, Blood Rage: Feldherr Inlay, Blood Rage: Folded Space Insert, Blood Rage: Geekmod Organizer, Blood Rage: Insert Here Insert, Blood Rage: Playmat Board, Blood Rage: The GiftForge Insert, Blood Rage: Tower Rex Organizer",0,114.14,0,0,"174506, 174849, 311901, 174801, 193898, 174388, 350961, 310026, 175100, 286883, 365507",Strategy Games,"Animals: Wild boar, Category: Dized Tutorial, Components: Control Boards, Components: Dynamic Event Boards, Components: Map (Continental / National scale), Components: Miniatures, Creatures: Monsters, Crowdfunding: Kickstarter, Digital Implementations: Board Game Arena, Digital Implementations: Steam, Digital Implementations: TableTop Simulator Mod (TTS), Game: Blood Rage, Misc: Watch It Played How To Videos, Mythology: Norse, Theme: Vikings",11.57,"Krv i Bes, Кровь и Ярость, Кръв и Ярост, Лють крові, ブラッドレイジ, 血色狂怒, 블러드 레이지",,,,,,,,
31260,Agricola,Uwe Rosenberg,Lookout Games,Klemens Franz,2007,1,5,150,30,150,12,74546,7.87,7.74,58,0,13987,6392,3.63,1.55,0,87760,1398,1142,12608,,C:\Users\thoma\Downloads\bgg1toolu\img\031260.jpg,"Animals, Economic, Farming","Automatic Resource Growth, Closed Drafting, Enclosure, Increase Value of Unchosen Resources, Solo / Solitaire Game, Turn Order: Claim Action, Worker Placement",,R,R,B,B,R,N,N,N,N,N,N,N,N,N,N,N,N,N,N,N,"Description originally from BoardgameNewsIn Agricola, you're a farmer in a wooden shack with your spouse and little else. At first, on a turn, your family gets to take only two actions, one for you and one for your spouse, as might be found among all the possibilities on a farm: plowing fields; collecting materials; building fences, and so on. There are numerous choices available, and while the game progresses you'll have more and more, as each round a new action card is flipped over, offering one more poss...",N,0,,,,"200680, 359999, 119890, 255262, 440149, 210625, 205418, 102794","Agricola (Revised Edition), Agricola 15, Agricola: All Creatures Big and Small, Agricola: All Creatures Big and Small - The Big Box, Agricola: Dead Harvest, Agricola: Expansion for 5 and 6 Players, Agricola: Family Edition, Caverna: The Cave Farmers",,,440147,Agricola: Special Edition,,,"138404, 138357, 147131, 273442, 142921, 273443, 266245, 384135, 153079, 291173, 264122, 186791, 273445, 138372, 358609, 142918, 156478, 138955, 138356, 273444, 138375, 138374, 138376, 205557, 138403, 138373, 138371, 150799, 138377","Agricola: Animeeples Wooden Farm Animals, Agricola: Autumn Board, Agricola: e-Raptor Organizer, Agricola: Epicycle Clay Animal Set, Agricola: Family Member Sticker Sheet, Agricola: Farmer Family Set, Agricola: Folded Space Insert, Agricola: Go7 Gaming Insert, Agricola: Holiday Board, Agricola: Insert Here Insert, Agricola: Kuhflecken Sticker, Agricola: Labels for Meeples, Agricola: Major Improvement Tokens, Agricola: Mars Board, Agricola: Meeple Source Food, Agricola: Pink player pieces, Agricola: Resourceeples and Veggiemeeples Set (Wooden Farm Resources and Vegetables), Agricola: Resourceeples Wooden Farm Resources, Agricola: Spring Board, Agricola: Starting Player Token - Rooster, Agricola: Stoffbeutel, Agricola: The 5 Designer Boards, Agricola: Turquoise player pieces, Agricola: Upgrade Deck - Revised edition, Agricola: Veggiemeeples Wooden Farm Vegetables, Agricola: Wild West Board, Agricola: Winter Board, Agricola: Wooden Farmer set, Agricola: Yellow player pieces",0,38.45,0,0,"59158, 113413, 37235, 292850, 242392, 131403, 150732, 132592, 242391, 109012, 43018, 242390, 166463, 85704, 183316, 242388, 39090, 103182, 39256, 242389, 130847, 242350, 240737, 73833, 83697, 38641, 279703, 103183, 38733, 114557, 73500",Strategy Games,"Animals: Cattle / Cows, Animals: Horses, Animals: Pigs, Animals: Sheep, Components: Meeples (Animal) / Animeeples, Components: Wooden pieces & boards, Digital Implementations: Board Game Arena, Digital Implementations: Boiteajeux, Game: Agricola, Mechanism: Tableau Building, Misc: BGG Hall of Fame, Misc: Dice Tower Hall of Fame, Occupation: Farmer, Players: Games with Solitaire Rules, Series: Harvest (Uwe Rosenberg), Theme: Food / Cooking",11.58,"Агрикола, アグリコラ, 农场主, 農家樂, 아그리콜라",,,,,,,,
251661,Oathsworn: Into the Deepwood,Jamie Jolly,Shadowborne Games,Francesca Baerald,2022,1,4,90,30,90,14,5816,8.88,7.73,59,0,1559,254,3.67,1.49,0,11552,112,593,5630,,C:\Users\thoma\Downloads\bgg1toolu\img\251661.jpg,"Adventure, Card Game, Dice, Exploration, Fantasy, Fighting, Miniatures, Mythology, Puzzle","Action Points, Card Play Conflict Resolution, Cooperative Game, Deck, Bag, and Pool Building, Dice Rolling, Hand Management, Hexagon Grid, Legacy Game, Modular Board, Pattern Recognition, Push Your Luck, Role Playing, Scenario / Mission / Campaign Game, Storytelling, Variable Player Powers",,R,B,R,B,N,N,N,N,N,N,N,N,N,N,N,N,N,N,N,N,Oathsworn is a Twisting Tales Game for 1-4 players where play is focused on narrative choices and rich miniature combat encounters. The game is set in the Deepwood where a Free company (the Oathsworn) fights for humanity's survival against unnatural horrors and the Deepwood itself.Each gaming session sees the players participate in a multi path game book where the story unfolds to an inevitable encounter. The encounters are multi phase scripted boss fights on the encounter board where players have to outwit...,N,0,,,,,,,,,,,,"402643, 402315, 371408, 412392, 410258, 371406, 314493, 314560, 416875, 410259, 402314, 402313, 314496, 314498, 416874, 417464","Oathsworn: Into the Deepwood - 1st to 2nd Edition Upgrade Pack, Oathsworn: Into the Deepwood - Amberlight Dice Set, Oathsworn: Into the Deepwood - Extra Set of Dice, Oathsworn: Into the Deepwood - Extra Standees, Oathsworn: Into the Deepwood - Heavy Metal Dice, Oathsworn: Into the Deepwood - Map Pack, Oathsworn: Into the Deepwood - Metal Coins, Oathsworn: Into the Deepwood - Mystery Chests, Oathsworn: Into the Deepwood - Mystery Chests: Tinkering Paws Insert, Oathsworn: Into the Deepwood - Oathstone Free Company Marker, Oathsworn: Into the Deepwood - Premium Faux Leather Dice Tray, Oathsworn: Into the Deepwood - Premium Pouch Pack, Oathsworn: Into the Deepwood - Terrain Pack, Oathsworn: Into the Deepwood - The Armory, Oathsworn: Into the Deepwood - Tinkering Paws Insert, Oathsworn: Laserox Organizer",0,233,0,0,"406500, 405827",Thematic Games,"Components: Miniatures, Components: Standees, Crowdfunding: Kickstarter, Mechanism: Campaign Games, Players: Games with Solitaire Rules, Theme: Boss Battle",13.94,"Oathsworn: Верные клятве - Тайны Темнолесья, 守誓者：深入密林",,,,,,,,
272637,Root: The Underworld Expansion,Patrick Leder,Leder Games,Kyle Ferrin,2020,2,6,90,60,90,10,5545,8.71,7.73,0,0,994,83,3.61,1.10,0,25488,115,280,2038,,C:\Users\thoma\Downloads\bgg1toolu\img\272637.jpg,"Animals, Expansion for Base-game, Fantasy, Wargame","Action Queue, Area Majority / Influence, Dice Rolling, Hand Management, King of the Hill, Point to Point Movement, Variable Player Powers",,N,P,R,B,R,P,N,N,N,N,N,N,N,N,N,N,N,N,N,N,New factions and battlefields join the world of Root!The Underworld Expansion includes:    The Great Underground Duchy: an imperial faction that mixes the flexibility of the Marquise with the escalating Eyrie Dynasties.    The Corvid Conspiracy: a secretive faction that hatches plots directly into the hands of their opponents.    Two new maps: dig tunnels on the mountain map or fight to control the ferry on the lake map.-description from the publisher,Y,237182,Root,,,,,,,,,,,"372735, 304572, 277157, 309436, 321231, 333841, 291811, 354048, 348514, 277897, 374816, 372737, 311505, 333840, 365830, 344578","Root expansions (Marauder + Underworld): The GiftForge Insert, Root: BGExpansions Upgrade Kit, Root: BGHQ Game Token Upgrade, Root: e-Raptor Insert, Root: Folded Space Insert, Root: Laserox Root Crate Organizer, Root: Playmat Fall/Winter, Root: Playmat Mountain/Lake, Root: reDrewno Insert, Root: Resin Clearing Markers, Root: The Dicetroyers Organizer, Root: The GiftForge All-in Insert, Root: The Underworld Expansion - GeekUp Bag Set, Root: The Underworld Expansion - Laserox Root Expansion Organizer, Root: Tower Rex Organizer, Root: Underworld and Clockwork - First Printing Correction Sticker",0,50.23,0,0,334483,"Strategy Games, Wargames","Animals: Birds, Animals: Crows / Ravens / Magpies, Animals: Moles, Crowdfunding: Kickstarter, Game: Root, Players: Expansions Changing Player Count, Theme: Animal Battles, Theme: Anthropomorphic Animals",10.75,"Root: A Földmélyi kiegészítő, Root: Die Unterwelt-Erweiterung, Root: Espansione Il Mondo Sotterraneo, Root: Expansão Submundo, Root: Expansión Los Subterráneos, Root: Monde Souterrain, Root: Podziemia, Root: Rozšíření Podzemní říše, Корни: Подземный мир, 茂林源記：地底擴充, 루트: 언더월드 확장",,,,,,,,
338960,Slay the Spire: The Board Game,Gary Dworetsky,Contention Games,Bruce Brenneise,2024,1,4,150,30,150,12,6156,8.72,7.72,60,0,1159,214,2.94,1.30,0,10635,26,717,6224,,C:\Users\thoma\Downloads\bgg1toolu\img\338960.png,"Adventure, Card Game, Fantasy, Video Game Theme","Cooperative Game, Deck, Bag, and Pool Building, Dice Rolling, Hand Management, Solo / Solitaire Game",,R,B,R,R,N,N,N,N,N,N,N,N,N,N,N,N,N,N,N,N,"Slay the Spire: The Board Game is a co-operative deck-building adventure. Craft a unique deck, encounter bizarre creatures, discover relics of immense power, and finally become strong enough to slay the Spire!Slay the Spire: The Board Game, (core edition) includes:-4 Minis-Over 730 cards-Over 450 Art Sleeves-2 Map Boards-1 Merchant Board-4 Player Boards-1 Die-50 plastic cubes-Over 113 tokensCollector's edition:4x (3mm neoprene) playermats1x deck playmatBigger box (fits mats)1x Merchant bagMetal coinsKicksta...",N,0,,,,,,,,,,,,"440472, 423812, 426800, 420036, 440471, 440473, 420682","Slay the Spire: Character & Deck Playmats, Slay the Spire: LaserLand Player Board Cube Set, Slay the Spire: LaserLand Progression Map Tokens, Slay the Spire: LaserLand Upgraded Token Set, Slay the Spire: Merchant Bag & Metal Coins, Slay the Spire: Table Playmat, Slay the Spire: The Board Game - Beta Art",0,157.97,0,0,,Strategy Games,"Admin: Better Description Needed!, Category: Dungeon Crawler, Crowdfunding: Kickstarter, Digital Implementations: TableTop Simulator Mod (TTS), Misc: LongPack Games, Players: Games with Solitaire Rules, Theme: Boss Battle",10.81,"Slay the Spire: Das Brettspiel, Slay the Spire: El Juego de Mesa, Slay the Spire: Gra Planszowa, Slay The Spire: O Jogo de Tabuleiro, 尖塔奇兵：桌面游戏, 슬레이 더 스파이어: 보드게임",,,,,,,,
255984,Sleeping Gods,Ryan Laukat,Red Raven Games,Ryan Laukat,2021,1,4,1200,60,1200,13,13900,8.15,7.72,61,0,2689,448,3.25,1.47,0,32223,344,1208,15903,,C:\Users\thoma\Downloads\bgg1toolu\img\255984.png,"Adventure, Exploration, Fantasy, Fighting, Nautical","Action Points, Cooperative Game, Events, Hand Management, Narrative Choice / Paragraph, Push Your Luck, Scenario / Mission / Campaign Game, Solo / Solitaire Game, Storytelling",,B,B,R,P,N,N,N,N,N,N,N,N,N,N,N,N,N,N,N,N,"""Are the stars unfamiliar here?"" she asked, and the sky grew suddenly dark, the star's patterns alien and exotic. ""This is the Wandering Sea. The gods have brought you here, and you must wake them if you wish to return home.""In Sleeping Gods, you and up to 3 friends become Captain Sofi Odessa and her crew, lost in a strange world in 1929 on your steamship, the Manticore. You must work together to survive, exploring exotic islands, meeting new characters, and seeking out the totems of the gods so...",N,0,,,,358320,Sleeping Gods: Distant Skies,,,331259,Sleeping Gods: Kickstarter Edition,,,"302009, 302010, 367210, 302012, 302011, 397397, 365795","Sleeping Gods: Custom Metal Coins, Sleeping Gods: Flexible Battle Mat, Sleeping Gods: Laserox Organizer, Sleeping Gods: Metal Ship, Sleeping Gods: Realistic Resources, Sleeping Gods: The GiftForge Insert, Sleeping Gods: Tower Rex Organizer",0,121.81,0,0,"287670, 376880, 309222, 328319, 283766, 327987",Thematic Games,"Components: Book as Board, Components: Map (City Scale), Components: Official Music Soundtrack, Crowdfunding: Kickstarter, Crowdfunding: Wspieram, Decades: The 1920's, Game: Sleeping Gods, Mechanism: Campaign Games, Misc: Forteller Audio Narration, Misc: Limited Replayability, Misc: Made by Panda, Misc: Watch It Played How To Videos, Players: Games with Solitaire Rules, Setting: The Wandering World",11.05,"Schlafende Götter, Spící bohové, Szunnyadó istenek, Uśpieni bogowie, Сплячі Боги, Сплячі Боги, Спящие боги, スリーピング・ゴッズ, 沉睡的神祇, 슬리핑 갓즈",,,,,,,,
161533,Lisboa,Vital Lacerda,Eagle-Gryphon Games,Ian O'Toole,2017,1,4,120,60,120,12,11909,8.18,7.71,62,0,2135,1086,4.58,1.46,0,17688,134,1049,6408,,C:\Users\thoma\Downloads\bgg1toolu\img\161533.jpg,"City Building, Economic, Industry / Manufacturing, Political","Area Majority / Influence, Hand Management, Multi-Use Cards, Open Drafting, Set Collection, Solo / Solitaire Game, Tile Placement",,R,R,B,R,N,N,N,N,N,N,N,N,N,N,N,N,N,N,N,N,"Lisboa is a game about the reconstruction of Lisboa after the great earthquake of 1755.On November 1, 1755, Lisbon suffered an earthquake of an estimated magnitude of 8.5-9.0, followed by a tsunami and three days of fires. The city was almost totally destroyed. The Marques of Pombal - Sebasti&atilde;o José de Carvalho e Melo - was the then Minister of Foreign Affairs and the King put him in charge of the reconstruction of Lisbon. The Marques of Pombal gathered a team of engineers and architects and you, the...",N,0,,,,262477,Mercado de Lisboa,,,,,,,"232915, 237375, 290603","Lisboa: Heavy Cardboard Promo, Lisboa: Metal Coins, Lisboa: Upgrade Pack",0,87.32,0,0,301771,Strategy Games,"Cities: Lisbon (Portugal), Components: Multi-Use Cards, Country: Portugal, Crowdfunding: Giochistarter, Crowdfunding: Kickstarter, Crowdfunding: Spieleschmiede, Digital Implementations: Tabletopia, Misc: Made by Panda, Players: Games with Solitaire Rules, Theme: Earthquakes",14.34,"Лиссабон, 里斯本, 리스보아",,,,,,,,
221107,Pandemic Legacy: Season 2,Rob Daviau,Z-Man Games,Atha Kanaani,2017,2,4,60,60,60,14,17565,8.02,7.71,63,0,2748,329,3.26,1.69,0,33683,256,308,4740,,C:\Users\thoma\Downloads\bgg1toolu\img\221107.jpg,"Environmental, Exploration, Medical, Science Fiction","Action Points, Cooperative Game, Hand Management, Legacy Game, Pick-up and Deliver, Point to Point Movement, Scenario / Mission / Campaign Game, Set Collection, Tags, Trading, Variable Player Powers",,N,R,R,B,N,N,N,N,N,N,N,N,N,N,N,N,N,N,N,N,"Description from the publisher:The world almost ended 71 years ago...The plague came out of nowhere and ravaged the world. Most died within a week. Nothing could stop it. The world did its best. It wasn't good enough.For three generations, we, the last fragments of humanity have lived on the seas, on floating stations called ""havens."" Far from the plague, we are able to provide supplies to the mainland to keep them (and us) from succumbing completely.We've managed to keep a network of the largest know...",N,0,,"30549, 161936","Pandemic, Pandemic Legacy: Season 1",314040,Pandemic Legacy: Season 0,,,,,,,309464,Pandemic Legacy: Season 1 & 2 - e-Raptor Insert,0,33.09,0,0,,"Strategy Games, Thematic Games","Components: Map (Global Scale), Game: Pandemic, Mechanism: Campaign Games, Mechanism: Legacy, Medical: Diseases, Misc: Limited Replayability, Misc: Made by Panda, Occupation: Medic / Doctor / Nurses, Occupation: Researcher / Scientist, Theme: Post-Apocalyptic, Versions & Editions: Legacy Versions of Non-Legacy Games, Versions & Editions: Sequels",12.18,"Pandemic Legacy: 2. Évad, Pandemic Legacy: Saison 2, Pandemic Legacy: Segunda temporada, Pandemic Legacy: Seizoen 2, Pandemic Legacy: Sezon 2, Пандемия Наследие Второй сезон, パンデミック:レガシー シーズン2, 瘟疫危机：传承 第二季 黄, 팬데믹 레거시: 시즌2",,,,,,,,
231733,Obsession,Dan Hallagan,Kayenta Games,Dan Hallagan,2018,1,4,90,30,90,14,15083,8.11,7.71,64,0,2811,549,3.10,1.34,0,21551,100,1257,8263,,C:\Users\thoma\Downloads\bgg1toolu\img\231733.png,Post-Napoleonic,"Action Retrieval, Deck, Bag, and Pool Building, Hand Management, Open Drafting, Solo / Solitaire Game",,R,B,R,R,N,N,N,N,N,N,N,N,N,N,N,N,N,N,N,N,"You are the head of a respected but troubled family estate in mid-19th century Victorian England. After several lean decades, family fortunes are looking up! Your goal is to improve your estate so as to be in better standing with the truly influential families in Derbyshire.Obsession is a game of 16 to 20 turns in which players build a deck of Victorian gentry (British social upper class), renovate their estate by acquiring building tiles from a centralized builders' market, and manipulate an extensive serv...",N,0,,,,,,,,,,,,"349193, 403800","Obsession: Meeple Source Characters, Obsession: Metal Coins",0,90.73,0,0,"397067, 405786, 432656, 284466, 306634, 279067, 338349, 245392","Strategy Games, Thematic Games","Components:  Meeples, Country: England, Crowdfunding: Kickstarter, Digital Implementations: Board Game Arena, Game: Obsession, Mechanism: Tableau Building, Misc: Made by Panda, Players: Games with Solitaire Rules",12.39,"Obsesión, Obsesje, Posedlost, Обольщение, 庄园迷情, 업세션",,,,,,,,
40849,Pandemic: On the Brink,Matt Leacock,Z-Man Games,Josh Cappel,2009,2,5,45,45,45,8,18095,8.03,7.71,0,0,4028,813,2.65,1.12,0,52409,570,394,3067,,C:\Users\thoma\Downloads\bgg1toolu\img\040849.jpg,"Expansion for Base-game, Environmental, Medical, Science Fiction","Action Points, Cooperative Game, Hand Management, Hidden Movement, Point to Point Movement, Secret Unit Deployment, Set Collection, Tags, Team-Based Game, Trading, Variable Player Powers",,N,R,R,B,R,N,N,N,N,N,N,N,N,N,N,N,N,N,N,N,"Pandemic: On the Brink includes new event cards, new role cards, rules for five players, and optional game challenges to increase the difficulty of the Pandemic base game. These new challenges, which can be used individually or combined for even more difficult play, are as follows:    The Virulent Strain challenge makes one disease become particularly deadly in unpredictable ways.    The Mutation challenge adds a fifth (purple) disease that behaves differently than the original four.    The Bio-Terrorist ch...",Y,30549,Pandemic,,,,,48791,"Pandemie: Uitbreiding ""De Generalist""",,,,,"272771, 333623, 374835, 208127, 148362, 348646, 365814","Pandemic: Biohazard Containment Unit, Pandemic: Folded Space Insert, Pandemic: GolonkoCrafts 3D Printed Tokens (w/ 5th Disease), Pandemic: In the Lab & On the Brink Character Meeples, Pandemic: On the Brink Replacement Deck, Pandemic: The GiftForge Insert, Pandemic: Tower Rex Organizer",0,25.90,0,0,"137136, 168703",Strategy Games,"Game: Pandemic, Mechanism: Hidden Movement, Medical: Diseases, Occupation: Medic / Doctor / Nurses, Occupation: Researcher / Scientist, Players: Expansions Changing Player Count, Players: One versus Many",10.10,"Pandemia: Na krawędzi, Pandemia: På katastrofens rand, Pandemia: Sull'Orlo dell'Abisso, Pandemia: Tuhon partaalla, Pandemic: ¡Al Límite!, Pandemic: À Beira do Caos, Pandemic: Extreem Gevaar, Pandemic: Na krawędzi, Pandemic: No Limite, Pandemic: Nové hrozby, Pandemic: Pe Muchie de Cuțit, Pandemic: Pengeélen, Pandémie: Au seuil de la catastrophe, Pandemie: Auf Messers Schneide, Pandemie: Virus Alarm, Пандемия: На грани, Пандемія: На Межі, パンデミック：迫りくる危機, パンデミック拡張セット　絶体絶命, 瘟疫危機 一觸即發 (瘟疫危机 一触即发), 瘟疫危機︰一觸即發, 팬데믹: 벼랑 끝에서",,,,,,,,
