id,name,designer,publisher,artist,yearpublished,minplayers,maxplayers,playingtime,minplaytime,maxplaytime,age,usersrated,average,bayesaverage,rank,rank_wg,numcomments,numweights,averageweight,stddev,median,owned,trading,wanting,wishing,userrating,image,category,mechanic,comment,1player,2player,3player,4player,5player,6player,7player,8player,9player,10player,11player,12player,13player,14player,15player,16player,17player,18player,19player,20player,description,exp,basegame,basegame_name,reimplement,reimplement_name,reimplemented,reimplemented_name,contains,contains_name,iscontained,iscontained_name,integration,integration_name,accessories,accessories_name,numplays,price,userweight,wishpriority,expansions,domain,family,age_poll,name_others,comments_GL,thumbs_GL,sold_GL,price_GL,currency_GL,user_GL,tags,tags_user
192135,Too Many Bones,Josh J. Carlson,Chip Theory Games,Anthony LeTourneau,2017,1,4,120,60,120,12,15188,8.33,7.88,31,0,2637,582,3.86,1.53,0,23468,151,1438,12240,,C:\Users\thoma\Downloads\bgg1toolu\img\192135.png,"Adventure, Dice, Fantasy, Fighting","Cooperative Game, Dice Rolling, Die Icon Resolution, Grid Movement, Narrative Choice / Paragraph, Resource to Move, Role Playing, Scenario / Mission / Campaign Game, Solo / Solitaire Game, Square Grid, Stat Check Resolution, Tech Trees / Tech Tracks, Turn Order: Role Order, Variable Player Powers",,R,B,R,R,N,N,N,N,N,N,N,N,N,N,N,N,N,N,N,N,"Too Many Bones comes loaded for bear by breaking into a new genre: the dice-builder RPG. This game takes everything you think you know about dice-rolling and turns it on its head. Dripping with strategy, this fantasy-based RPG puts you in the skin of a new race and takes you on an adventure to the northern territories to root out and defeat growing enemy forces and of course the infamous ""baddie"" responsible.Team up or go it alone in a 1-4 player Coop or Solo play campaign. With over 100+ unique skill...",N,0,,,,,,,,,,"347811, 235802, 347811, 235802","Too Many Bones: Unbreakable, Too Many Bones: Undertow, Too Many Bones: Unbreakable, Too Many Bones: Undertow","304186, 224900, 241666, 257758, 408117, 349908, 231298, 338906, 349928, 330266, 286419, 378406, 404826, 351147, 330270, 350241, 330271, 224901, 330263, 294829, 369316","Too Many Bones: 2019 Update Pack, Too Many Bones: Adventure Map, Too Many Bones: Adventure Map 2.0, Too Many Bones: Ally Pack, Too Many Bones: BrassMag Figures, Too Many Bones: Collapsible Dice Tower, Too Many Bones: Component Update Pack, Too Many Bones: Control ‘Ur Roll Dice Tray, Too Many Bones: Deluxe Playmat, Too Many Bones: Fireworks Boomer, Too Many Bones: Flip Chips, Too Many Bones: Gearloc Skeleton Promo Chips, Too Many Bones: Gearloc Tray (2-Pack), Too Many Bones: German Language Pack, Too Many Bones: Like a Florist Tantrum, Too Many Bones: Modular Playmats, Too Many Bones: Nightmare Picket, Too Many Bones: Premium Health, Too Many Bones: Slasher Patches, Too Many Bones: Trove Chest, Too Many Bones: Tyrant and Gearloc Deluxe Storage",0,159.95,0,0,"330260, 330268, 330276, 349753, 383414, 368600, 239292, 319418, 239291, 312891, 330275, 246285, 236503, 349581, 299653, 357218, 283861, 257999, 240993, 239290, 224899, 283862, 402489, 224897, 349579, 349578, 370264, 281285, 349580, 349916, 307612, 246284, 224898, 276939","Strategy Games, Thematic Games","Components: 4 x 4 Grids, Components: Dice with Icons, Components: PVC Cards, Crowdfunding: Kickstarter, Digital Implementations: Tabletopia, Game: Too Many Bones, Mechanism: Campaign Games, Players: Games with Solitaire Rules, Theme: Boss Battle",12.30,"Kosti jsou vrženy, Слишком много костей, 骸骨險境, 투 매니 본즈",,,,,,,,
120677,Terra Mystica,Jens Drögemüller,Feuerland Spiele,Dennis Lohausen,2012,2,5,150,60,150,12,49405,8.04,7.87,32,0,7116,2977,3.98,1.47,0,53485,900,1523,14051,,C:\Users\thoma\Downloads\bgg1toolu\img\120677.jpg,"Civilization, Economic, Fantasy, Territory Building","Chaining, End Game Bonuses, Hexagon Grid, Income, Increase Value of Unchosen Resources, Network and Route Building, Tech Trees / Tech Tracks, Turn Order: Pass Order, Variable Player Powers, Variable Set-up, Victory Points as a Resource",,N,P,R,B,R,N,N,N,N,N,N,N,N,N,N,N,N,N,N,N,"In the land of Terra Mystica dwell 14 different peoples in seven landscapes, and each group is bound to its own home environment, so to develop and grow, they must terraform neighboring landscapes into their home environments in competition with the other groups.Terra Mystica is a full information game, without any luck, that rewards strategic planning. Each player governs one of the 14 groups. With subtlety and craft, the player must attempt to rule as great an area as possible and to develop that group's ...",N,0,,,,"383179, 220308, 364186","Age of Innovation, Gaia Project, Terra Nova",,,"181289, 356238","Terra Mystica: Big Box, Terra Mystica: Big Box",,,"151293, 370562, 179551, 281702, 193661, 295955, 286999, 334050, 334046, 435732, 272790, 274570, 271251, 359430, 368422, 348656, 348655, 167945, 288427","Terra Mystica: Acrylic Overlay Set, Terra Mystica: BoardGameSet Upgrade Set, Terra Mystica: e-Raptor Organizer, Terra Mystica: Folded Space Insert, Terra Mystica: Game Trayz, Terra Mystica: GeekUp BITS Bag Set, Terra Mystica: GeekUp Player Bag Set, Terra Mystica: Laserox Terra Mystica Crate, Terra Mystica: Laserox TerrArranger Organizer, Terra Mystica: Moedas & Co. Metal Coins, Terra Mystica: Mystical Terrain Organizer, Terra Mystica: Mystical Terrain Player Overlays, Terra Mystica: Quick-Start Insert, Terra Mystica: Saim Lab Organizer, Terra Mystica: The Dicetroyers Organizer, Terra Mystica: The GiftForge Base Insert, Terra Mystica: The GiftForge Insert, Terra Mystica: Vulkan & Eis, Terra Mystica: Worker Meeples",0,48.66,0,0,"149890, 349169, 356035, 161317, 280885, 184895, 150740",Strategy Games,"Category: Combinatorial, Components: Control Boards, Components: Map (Continental / National scale), Components: Wooden pieces & boards, Creatures: Dwarves & Gnomes, Digital Implementations: Board Game Arena, Digital Implementations: Google Play, Digital Implementations: Steam, Digital Implementations: Tabletopia, Digital Implementations: Yucata, Mechanism: Tableau Building, Misc: BGG Hall of Fame, Series: Terra Mystica",12.77,"Терра Мистика, テラミスティカ, 神秘大地, 테라 미스티카",,,,,,,,
368966,Ark Nova: Marine Worlds,Mathias Wigge,Feuerland Spiele,Steffen Bieker,2023,1,4,150,90,150,14,5333,8.92,7.87,0,0,859,108,3.82,1.10,0,21851,43,227,1929,,C:\Users\thoma\Downloads\bgg1toolu\img\368966.jpg,"Expansion for Base-game, Animals, Economic, Environmental","End Game Bonuses, Hand Management, Hexagon Grid, Income, Open Drafting, Set Collection, Solo / Solitaire Game, Tile Placement, Variable Player Powers, Variable Set-up",,R,B,B,R,N,N,N,N,N,N,N,N,N,N,N,N,N,N,N,N,"Ark Nova: Marine Worlds, an expansion for Ark Nova, introduces multiple new elements to the game, such as sea animals that each have to be played in new special enclosures that must be built adjacent to water.Roughly half the sea animals are reef dwellers, and whenever you add a reef dweller to your zoo, you trigger the ability of all reef dwellers in your zoo. To deal with the dilution of the deck, naturally caused by adding more cards, all sea cards feature a wave icon, and whenever it is revealed in the ...",Y,342942,Ark Nova,,,,,,,,,,,"433128, 417453, 419824, 426880, 368014","Ark Nova + Marine Worlds: Eurohell Design Insert, Ark Nova Marine Upgrade Kit: Laserox Organizer, Ark Nova: LaserLand Marine Worlds Association Board Overlay, Ark Nova: Moedas & Co. Metal Coins, Ark Nova: reDrewno Insert",0,23.18,0,0,,Strategy Games,"Components: Hexagonal Tiles, Game: Ark Nova, Players: Games with Solitaire Rules, Theme: Ecology, Theme: Science",13,"Archa Nova: Vodní světy, Arche Nova: Wasserwelten, Ark Nova: Lumi Acvatice, Ark Nova: Merimaailmat, Ark Nova: Mondes Marins, Ark Nova: Mondi Sommersi, Ark Nova: Mundo Marino, Ark Nova: Mundos Marinhos, Ark Nova: Vízi világ kiegészítő, Ark Nova: Waterwereld, Ark Nova: Wodny Świat, Новий Ковчег: Морські Світи, 方舟动物园：海洋世界, 아크 노바 확장: 마린 월드",,,,,,,,
266192,Wingspan,Elizabeth Hargrave,Stonemaier Games,Ana Maria Martinez Jaramillo,2019,1,5,70,40,70,10,102326,8.02,7.87,33,0,13646,3396,2.47,1.37,0,161586,826,1292,20198,,C:\Users\thoma\Downloads\bgg1toolu\img\266192.jpg,"Animals, Card Game, Educational","Action Queue, Dice Rolling, End Game Bonuses, Hand Management, Once-Per-Game Abilities, Open Drafting, Set Collection, Solo / Solitaire Game, Turn Order: Progressive",,R,R,B,R,P,N,N,N,N,N,N,N,N,N,N,N,N,N,N,N,"Wingspan is&nbsp;a competitive, medium-weight, card-driven, engine-building board game from Stonemaier Games. It's designed by Elizabeth Hargrave and features 180 birds illustrated by Natalia Rojas and Ana Maria Martinez.You are bird enthusiasts-researchers, bird watchers, ornithologists, and collectors-seeking to discover and attract the best birds to your network of wildlife preserves. Each bird extends a chain of powerful combinations in one of your habitats (actions). These habitats  focus on several ke...",N,0,,,,"436126, 410201","Finspan, Wyrmspan",,,,,"366161, 366161","Wingspan Asia, Wingspan Asia","419414, 337694, 385692, 382383, 347405, 400722, 279529, 288012, 319459, 369406, 321747, 309487, 306762, 402091, 402724, 393448, 315526, 330947, 291710, 308310, 393955, 405113, 328253, 271952, 406412, 365511, 279528, 279530, 430965, 326043, 366362, 308098, 299030, 316489, 372068, 400380, 346690, 336149, 366363, 365816, 331898, 308103, 343462, 339260, 305000, 385710, 348603, 365817, 365812, 294178, 365803, 365802, 382600, 393808, 292334, 284961, 432830","Na křídlech: Dřevěná házecí budka, Na skrzydłach: reDrewno Insert, Wingspan (+Europa +Oceania +Asia): The GiftForge Insert, Wingspan (+European and Oceania): Tower Rex Organizer, Wingspan + European and Oceania expansion: Game Tamer Organizer, Wingspan: BGExpansions Upgrade Kit, Wingspan: Birdhouse Upgrade Kit (40 pcs), Wingspan: Broken Token Organizer, Wingspan: Card Update Pack, Wingspan: Crocheted Egg & Food Token Nests, Wingspan: Double-Sided Wrapped-Edge Goal Board, Wingspan: e-Raptor Insert, Wingspan: Egg Miniatures (75 pcs), Wingspan: European Expansion - Vision-Friendly Cards, Wingspan: Fan Art Pack, Wingspan: Feldherr Organizer, Wingspan: Folded Space Insert, Wingspan: Folded Space Insert (Second edition), Wingspan: GeekUp Bit Set, Wingspan: GeekUp Mini 1st Player Figure, Wingspan: Go7 Gaming insert, Wingspan: Golden Eggs, Wingspan: Holy Tokens Realistic Food Tokens, Wingspan: Insert Here Insert, Wingspan: Matagot Wooden Food Upgrade Kit, Wingspan: Meeple Source 3D Printed Nests, Wingspan: Meeple Source Bird Food Upgrade Kit (105 pcs), Wingspan: Meeple Source Deluxe Bird Upgrade Set (81 pcs), Wingspan: Meeple Source Large Scissor-Tailed Flycatcher First Player Token, Wingspan: Mini Dice Tower Kit - Birdhouse, Wingspan: Momo Monster Action Bird Pieces Upgrade, Wingspan: Momo Monster Food Tokens, Wingspan: Mücke Spiele Wooden Token Set, Wingspan: Neoprene Player Mat, Wingspan: Nesting Box, Wingspan: Oceania Expansion - BGExpansions Nectar Tokens, Wingspan: Oceania Expansion - GeekUp Bit Set, Wingspan: Oceania Expansion - Meeple Source Nectar tokens (69 pcs), Wingspan: Oceania Expansion - Momo Monster 70-Piece Nectar Upgrade Set, Wingspan: Oceania Expansion - Tower Rex 48-Piece Wooden Nectar Token Set, Wingspan: Pair of Single-Sided Neoprene Goal Mats, Wingspan: Shipshape Game Box Organizer, Wingspan: Shipshape Gamer Owl Player Markers, Wingspan: Speckled Eggs, Wingspan: The Game Doctors Insert, Wingspan: The GiftForge Bird house dice tower, Wingspan: The GiftForge Insert, Wingspan: Tower Rex 105-Piece Wooden Food Token Set, Wingspan: Tower Rex 40-Piece Player Token Set, Wingspan: Tower Rex Organizer, Wingspan: Tower Rex Playerboard, Wingspan: Tower Rex Scoreboard, Wingspan: TowerRex Duel Player's Birds Set, Wingspan: Vision-Friendly Cards, Wingspan: WingMate, Wingspan: Wooden Dice Tower, Wyrmspan/Wingspan: Stone Eggs",0,54.49,0,0,"339017, 290448, 368895, 300580, 290837","Family Games, Strategy Games","Animals: Birds, Animals: Crows / Ravens / Magpies, Animals: Ducks, Animals: Eagles, Animals: Geese, Animals: Owls, Animals: Turkeys, Components: Control Boards, Components: Dice with Icons, Components: Drop Tower, Components: Game Trayz Inside, Digital Implementations: Apple App Store, Digital Implementations: Board Game Arena, Digital Implementations: Google Play, Digital Implementations: Steam, Digital Implementations: TableTop Simulator Mod (TTS), Digital Implementations: Tabletopia, Game: Wingspan, Mechanism: Tableau Building, Misc: Made by Panda, Misc: Watch It Played How To Videos, Organizations: Automa Factory, Players: Games with Solitaire Rules, Theme: Biology, Theme: Nature",9.56,"Fesztáv, Flügelschlag, Na křídlech, Na skrzydłach, Spārnotie, Sparnuotieji, Tiivulised, Wingspan srpsko izdanje, Wingspan: Lumea păsărilor, Άνοιγμα φτερών, Крила, Криле, Крылья, ปีกปักษา, ウイングスパン, 展翅翱翔, 윙스팬",,,,,,,,
218127,Terraforming Mars: Hellas & Elysium,Jacob Fryxelius,FryxGames,Isaac Fryxelius,2017,1,5,120,90,120,12,11383,8.38,7.87,0,0,1792,165,2.79,1.16,0,38544,113,181,1371,,C:\Users\thoma\Downloads\bgg1toolu\img\218127.jpg,"Expansion for Base-game, Economic, Environmental, Industry / Manufacturing, Science Fiction, Space Exploration, Territory Building","Closed Drafting, Hand Management, Tile Placement, Variable Player Powers",,R,R,B,R,R,N,N,N,N,N,N,N,N,N,N,N,N,N,N,N,"Terraforming Mars: Hellas & Elysium, the first expansion for Terraforming Mars, consists of a double-sided game board presenting two new areas of Mars:- Elysium takes players almost to the opposite side of Mars' equator, with vast lowlands for oceans in the north and a dry, mineral-rich south. Place a tile on Olympus Mons, the highest peak in the solar system, to gain three free cards!- Hellas, the southern wild, includes Mars' south pole and the enormous seven-hex Hellas crater that just begs to become a g...",Y,167791,Terraforming Mars,,,,,,,,,,,"334522, 429823, 365388, 263728, 326364, 365387, 271967, 326742, 373842, 348608, 426252","Terraformacja Marsa: reDrewno Insert, Terraforming Mars: Cardboard Map Standalone Box, Terraforming Mars: Elysium - Big Board Edition, Terraforming Mars: Folded Space Insert, Terraforming Mars: Folded Space Insert (Second edition), Terraforming Mars: Hellas - Big Board Edition, Terraforming Mars: Insert Here Insert, Terraforming Mars: Laserox Terraformer's Toolbox Insert, Terraforming Mars: Spike Craft Insert, Terraforming Mars: The GiftForge Insert, Terraforming Mars: Upended Games Organizer",0,15.06,0,0,,Strategy Games,"Game: Terraforming Mars, Series: Terraforming Mars, Setting: Future Timeline (Fryxgames), Space: Earth's Solar System, Space: Mars",11.76,"A Mars Terraformálása: Hellas & Elysium, Mars: Teraformace - Hellas & Elysium, Teraformiranje Marsa: Helas i Elisijum, Terraformacja Marsa: Hellas i Elysium, Покорение Марса. Эллада и Элизий, Тераформування Марса: Еллада та Елізій, ภาคเสริมพลิกภิภพดาวอังคาร: เฮลลาส & เอลิเซียม, テラフォーミング・マーズ拡張 ヘラス＆エリシウム, 重塑火星：希臘與埃律西昂, 테라포밍 마스 확장: 헬라스 앤 엘리시움",,,,,,,,
164928,Orléans,Reiner Stockhausen,dlp games,Klemens Franz,2014,2,5,90,90,90,12,33389,8.05,7.86,34,0,4722,1136,3.02,1.17,0,40773,320,1372,9064,,C:\Users\thoma\Downloads\bgg1toolu\img\164928.jpg,"Medieval, Religious, Travel","Contracts, Deck, Bag, and Pool Building, End Game Bonuses, Events, Kill Steal, Point to Point Movement, Simultaneous Action Selection, Tech Trees / Tech Tracks, Turn Order: Progressive, Variable Set-up, Worker Placement, Different Worker Types",,N,R,R,B,P,N,N,N,N,N,N,N,N,N,N,N,N,N,N,N,"During the medieval goings-on around Orléans, you must assemble a following of farmers, merchants, knights, monks, etc. to gain supremacy through trade, construction and science in medieval France.In Orléans, you will recruit followers and put them to work to make use of their abilities. Farmers and Boatmen supply you with money and goods; Knights expand your scope of action and secure your mercantile expeditions; Craftsmen build trading stations and tools to facilitate work; Scholars make progress in scien...",N,0,,,,"364641, 287275","Joan of Arc: Orléans Draw & Write, Orléans Stories",,,"420068, 171905","Orléans: Anniversary Box, Orléans: Deluxe Edition",,,"219822, 219817, 219816, 267455, 326367, 266277, 432908, 319362, 333837, 333838, 340278, 404074, 274939, 219824, 219820, 219819, 219818, 219821, 219823","Orléans: Additional wooden character tile replacements, Orléans: All inclusive upgrade kit, Orléans: Components for a 5th player, Orléans: Folded Space Insert, Orléans: Folded Space Insert (Second edition), Orléans: GeekUp Bit Set, Orleans: GeekUp Plague Expansion Bit Set, Orléans: Go7 Gaming Insert, Orléans: Laserox Coffret de Tri Big Box, Orléans: Laserox Coffret de Tri Organizer, Orléans: Metal Coin Set, Orléans: Pest Upgrade Kit, Orléans: Resource Upgrade Kit, Orléans: Score block, Orléans: Stickers for wooden character and technology tiles replacements (back), Orléans: Stickers for wooden character and technology tiles replacements (front), Orléans: Upgrade kit, Orléans: Wooden character tile replacements, Orléans: Wooden technology tile replacements",0,49.84,0,0,"178656, 317189, 289400, 231964, 189623, 186236, 231405, 307822, 190049, 286020, 183682, 247797, 179417, 184018, 185922, 211082, 237163, 443274, 234593, 210145, 237167, 249576, 307008, 166842, 398047, 204814, 175844, 309312",Strategy Games,"Cities: Orléans (France), Components: Map (Continental / National scale), Country: France, Crowdfunding: Kickstarter, Crowdfunding: Wspieram, Digital Implementations: Board Game Arena, Digital Implementations: Tabletopia, Game: Orléans, Misc: Made by Panda, Players: Games with expansions that add solo play, Religious: Monks/Abbots & Monasteries/Abbeys",11.07,"Orlean, Орлеан, オルレアン, 奧爾良, 오를레앙",,,,,,,,
96848,Mage Knight Board Game,Vlaada Chvátil,WizKids (I),J. Lonnee,2011,1,4,240,60,240,14,34149,8.08,7.85,35,0,6522,2762,4.37,1.64,0,46723,1009,1185,12558,,C:\Users\thoma\Downloads\bgg1toolu\img\096848.jpg,"Adventure, Exploration, Fantasy, Fighting, Miniatures","Card Play Conflict Resolution, Cooperative Game, Deck, Bag, and Pool Building, Dice Rolling, Grid Movement, Hand Management, Hexagon Grid, Modular Board, Multi-Use Cards, Open Drafting, Role Playing, Solo / Solitaire Game, Tags, Turn Order: Claim Action, Variable Player Powers",,B,B,R,P,N,N,N,N,N,N,N,N,N,N,N,N,N,N,N,N,"The Mage Knight board game puts you in control of one of four powerful Mage Knights as you explore (and conquer) a corner of the Mage Knight universe under the control of the Atlantean Empire. Build your army, fill your deck with powerful spells and actions, explore caves and dungeons, and eventually conquer powerful cities controlled by this once-great faction!  In competitive scenarios, opposing players may be powerful allies, but only one will be able to claim the land as their own.  In cooperative scena...",N,0,,,,182340,Star Trek: Frontiers,,,248562,Mage Knight: Ultimate Edition,,,"193920, 193921, 310077, 295882, 271252","Mage Knight Board Game: Broken Token organizer, Mage Knight Board Game: Broken Token Organizer - Extra Dividers, Mage Knight Board Game: Folded Space Insert, Mage Knight Board Game: Playmats, Mage Knight Board Game: Quick-Start Insert",0,51.87,0,0,"277519, 144763, 176130, 130704, 416403","Strategy Games, Thematic Games","Components: Clix, Components: Miniatures, Components: Multi-Use Cards, Players: Games with Solitaire Rules, Setting: Mage Knight",13.88,"Mage Knight: Das Brettspiel, Mage Knight: Desková hra, Mage Knight: Gra Planszowa, Mage Knight: Il Gioco Da Tavolo, Mage Knight: Jeu de Plateau, 魔法騎士",,,,,,,,
251247,Barrage,Tommaso Battista,Cranio Creations,Mauro Alocci,2019,1,4,120,60,120,14,19511,8.15,7.84,36,0,2791,1112,4.12,1.43,0,23815,161,891,6937,,C:\Users\thoma\Downloads\bgg1toolu\img\251247.png,"Economic, Environmental, Industry / Manufacturing","Action Retrieval, Contracts, End Game Bonuses, Income, Network and Route Building, Ownership, Solo / Solitaire Game, Turn Order: Stat-Based, Variable Player Powers, Variable Set-up, Worker Placement",,P,R,R,B,N,N,N,N,N,N,N,N,N,N,N,N,N,N,N,N,"In the dystopic 1930s, the industrial revolution pushed the exploitation of fossil-based resources to the limit, and now the only thing powerful enough to quench the thirst for power of the massive machines and of the unstoppable engineering progress is the unlimited hydroelectric energy provided by the rivers.Barrage is a resource management strategic game in which players compete to build their majestic dams, raise them to increase their storing capacity, and deliver all the potential power through pressu...",N,0,,,,,,,,,,,,"332735, 386434, 442103, 374564, 312897, 349830, 442104, 326749, 313597, 340076, 402795, 359668, 426775, 382559, 430095, 430093, 350984, 365828, 318011","Barrage: reDrewno Insert, Barrage: 3D Map, Barrage: Design Artwork Sleeves, Barrage: e-Raptor Insert, Barrage: Folded Space Insert, Barrage: GolonkoCrafts Water Droplets, Barrage: Inserty Herman Insert, Barrage: Laserox Barrage Organizer, Barrage: Meeple Realty Wooden Wheels, Barrage: Metal Coins, Barrage: Moedas & Co. Metal Coins, Barrage: Saim Lab Insert, Barrage: SL-3D Insert, Barrage: Sloyca Insert, Barrage: The Dicetroyers 4 Construction Wheels Set, Barrage: The Dicetroyers Insert, Barrage: The GiftForge Insert, Barrage: Tower Rex Organizer, Barrage: Wooden Machineries pack",0,82.85,0,0,"304453, 397438, 318010, 304458, 346071, 363533, 397434, 287521, 397437, 388973, 263711, 426268, 366469",Strategy Games,"Components: Control Boards, Crowdfunding: Kickstarter, Digital Implementations: Board Game Arena, Digital Implementations: Tabletopia, Game: Barrage, Occupation: Architect, Players: Games with Solitaire Rules, Theme: Art style - Art Deco, Theme: Dieselpunk, Theme: Electricity Generation",13.28,"Duzzasztómű, Přehrada, Wasserkraft, Гребля, Плотина, バラージ, 强国争坝, 버라지",,,,,,,,
373106,Sky Team,Luc Rémond,Scorpion Masqué,Eric Hibbeler,2023,2,2,15,15,15,12,19084,8.17,7.84,37,0,2354,450,2.05,1.13,0,40156,139,741,8833,,C:\Users\thoma\Downloads\bgg1toolu\img\373106.jpg,Aviation / Flight,"Communication Limits, Cooperative Game, Dice Rolling, Scenario / Mission / Campaign Game, Simulation, Worker Placement with Dice Workers",,N,B,N,N,N,N,N,N,N,N,N,N,N,N,N,N,N,N,N,N,"Sky Team is a co-operative game, exclusively for two players, in which you play a pilot and co-pilot at the controls of an airliner. Your goal is to work together as a team to land your airplane in different airports around the world.To land your plane, you need to silently assign your dice to the correct spaces in your cockpit to balance the axis of your plane, control its speed, deploy the flaps, extend the landing gear, contact the control tower to clear your path, and even have a little coffee to improv...",N,0,,,,,,,,,,,,"426898, 426639, 426638, 431255","Sky Team: Agon Spiele Insert, Sky Team: Eurohell 3D Tokens, Sky Team: Eurohell Insert, Sky Team: GGG Insert/Organizer",0,30.36,0,0,"423418, 418816, 414502, 404069, 405208, 412229, 429384, 422740, 404497, 423177, 422053","Family Games, Thematic Games","Category: Dized Tutorial, Digital Implementations: Board Game Arena, Digital Implementations: TableTop Simulator Mod (TTS), Players: Two-Player Only Games, Series: Two-player games (Kosmos)",9.66,"Halo wieża, A légi társaság, Nebeski tim, Sky Team: Προσδεθείτε!, Крутое пике, Пілоти, スカイチーム, 天合小队, 스카이 팀",,,,,,,,
66690,Dominion: Prosperity,Donald X. Vaccarino,Rio Grande Games,Joshua Gerald Balvin,2010,2,4,30,30,30,13,15294,8.23,7.84,0,0,2673,520,2.48,1.17,0,34141,311,351,1919,,C:\Users\thoma\Downloads\bgg1toolu\img\066690.jpg,"Card Game, Expansion for Base-game, Medieval","Deck, Bag, and Pool Building, Delayed Purchase, Hand Management, Open Drafting",,N,R,B,R,N,N,N,N,N,N,N,N,N,N,N,N,N,N,N,N,"Released in late 2010, Prosperity is the 4th addition to the Dominion game family. It adds 25 new Kingdom cards to Dominion, plus 2 new Basic cards that let players keep building up past Gold and Province. The central theme is wealth; there are treasures with abilities, cards that interact with treasures, and powerful expensive cards. (Source: http://www.riograndegames.com/games.html?id=361 )From the back of the box: ""Ah, money. There's nothing like the sound of coins clinking in your hands. You vastly p...",Y,"36218, 209418, 216849, 142132, 275626, 40834, 149083, 184207","Dominion, Dominion (Second Edition), Dominion (Second Edition) Big Box, Dominion: Big Box, Dominion: Einsteiger-Bigbox, Dominion: Intrigue, Dominion: Special Edition, Het Koninkrijk Dominion",,,362517,Dominion: Prosperity (Second Edition),,,142131,Dominion: Big Box,,,"137963, 302401, 138408, 419783","Dominion: Base Cards, Dominion: Chest, Dominion: Storage Box, Dominion: Tame My Games Organizer",0,23.56,0,0,"364019, 374339",Strategy Games,"Crowdfunding: Wspieram, Digital Implementations: VASSAL, Game: Dominion",10.26,"Dominion: Blütezeit, Dominion: Nousukausi, Dominion: Prosperidad, Dominion: Prosperita, Dominion: Prosperità, Dominion: Prospérité, Dominion: Welvaart, Dominion: Welvaart, Dominion: Złoty Wiek, ドミニオン：繁栄, 도미니언: 약속된 번영",,,,,,,,
