id,name,designer,publisher,artist,yearpublished,minplayers,maxplayers,playingtime,minplaytime,maxplaytime,age,usersrated,average,bayesaverage,rank,rank_wg,numcomments,numweights,averageweight,stddev,median,owned,trading,wanting,wishing,userrating,image,category,mechanic,comment,1player,2player,3player,4player,5player,6player,7player,8player,9player,10player,11player,12player,13player,14player,15player,16player,17player,18player,19player,20player,description,exp,basegame,basegame_name,reimplement,reimplement_name,reimplemented,reimplemented_name,contains,contains_name,iscontained,iscontained_name,integration,integration_name,accessories,accessories_name,numplays,price,userweight,wishpriority,expansions,domain,family,age_poll,name_others,comments_GL,thumbs_GL,sold_GL,price_GL,currency_GL,user_GL,tags,tags_user
193065,Spirit Island: Branch & Claw,R. Eric Reuss,Greater Than Games LLC,Jason Behnke,2017,1,4,120,90,120,14,7004,8.97,8.09,0,0,1250,227,4.23,1.09,0,27289,152,261,1459,,C:\Users\thoma\Downloads\bgg1toolu\img\193065.jpg,"Expansion for Base-game, Fantasy, Fighting, Mythology","Cooperative Game, Hand Management, Modular Board, Open Drafting, Simultaneous Action Selection, Variable Player Powers",,R,B,R,R,N,N,N,N,N,N,N,N,N,N,N,N,N,N,N,N,"The Branch & Claw Expansion for Spirit Island features:     Two new Spirits! (Sharp Fangs Behind the Leaves and Keeper of the Forbidden Wilds)     A new Adversary! (France)     A new step added to the Invader Phase of the game: Events! The Event Deck has events that happen each turn, adding further variation to the game play.     New Tokens that can be added to the board! Wilds, Disease and Strife Tokens prevent the Invaders from Exploring, Building and Ravaging, respectively, and Beast tokens represent the...",Y,162886,Spirit Island,,,,,,,,,,,"273036, 434378, 372965, 314281, 314280, 309476, 271287, 268243, 326361, 439515, 271950, 367225, 344500, 271283, 289436, 348652, 271394","Spirit Island: Basically Wooden Organiser, Spirit Island: Branch & Claw - Polandgames Token Set, Spirit Island: Branch and Claw - Premium Foil Spirit Panels, Spirit Island: Broken Token Game Crate, Spirit Island: Broken Token Organizer, Spirit Island: e-Raptor Insert, Spirit Island: Errata Pack, Spirit Island: Folded Space Insert, Spirit Island: Folded Space Insert (Second edition), Spirit Island: InMyBox Insert, Spirit Island: Insert Here Insert, Spirit Island: Laserox Crate, Spirit Island: Laserox Spirit Organizer, Spirit Island: Premium Token Pack, Spirit Island: Spirit Energy Tokens (32 tokens), Spirit Island: The GiftForge Insert, Spirit Island: Tower Rex Organizer",0,25.62,0,0,,Strategy Games,"Crowdfunding: Kickstarter, Game: Spirit Island, Misc: LongPack Games, Players: Games with Solitaire Rules",12.93,"Duchové ostrova: Trny a drápy, Spirit Island: Ast und Tatze, Spirit Island: De Branches et de Griffes, Spirit Island: Galhos e Garras, Spirit Island: Zarośla i Szpony, Остров духов: Ветви и когти, 정령섬: 가지와 발톱",,,,,,,,
342031,Dune: Imperium - Rise of Ix,Paul Dennen,Dire Wolf,Clay Brooks,2022,1,4,120,60,120,13,8516,8.80,8.06,0,0,1287,164,3.21,1.09,0,25794,100,307,2051,,C:\Users\thoma\Downloads\bgg1toolu\img\342031.jpg,"Expansion for Base-game, Movies / TV / Radio theme, Novel-based, Political, Science Fiction","Card Play Conflict Resolution, Deck, Bag, and Pool Building, Open Drafting, Race, Turn Order: Progressive, Variable Player Powers, Worker Placement",,R,R,B,B,N,N,N,N,N,N,N,N,N,N,N,N,N,N,N,N,"Conflict spreads across the Imperium in Dune: Imperium - Rise of Ix, the first expansion to the award-winning board game.     Enter the fray as one of three new Great Houses with unique leader abilities.     Acquire technological innovations from the planet Ix for a lasting strategic advantage.     Deploy fearsome dreadnoughts to rule the skies above Arrakis.     Dispatch subtle infiltrators to outmaneuver your opponents.     Dominate the Imperium in the new Epic game mode for a more intense, high-stakes ch...",Y,"316554, 397598","Dune: Imperium, Dune: Imperium - Uprising",,,,,,,,,,,"358128, 382557, 428576, 324114, 379830, 411880, 373066, 367216, 368406, 368402, 364160, 364161, 390600, 428958, 414753, 383267","Diuna: Imperium - reDrewno Insert, Diuna: Imperium - Sloyca Insert, Dune: Imperium - Cinder & Ember Insert, Dune: Imperium - Deluxe Upgrade Pack, Dune: Imperium - Dreadnought Upgrade Pack, Dune: Imperium - Eurohell Design Inlay, Dune: Imperium - Folded Space Insert, Dune: Imperium - Laserox Organizer, Dune: Imperium - LevityGames Meeple Sticker Upgrade Kit, Dune: Imperium - The Dicetroyers Organizer, Dune: Imperium - The GiftForge Insert, Dune: Imperium - The GiftForge player board, Dune: Imperium - The Mind Killer Playmat, Dune: Imperium - Uprising: Folded Space Insert, Dune: Imperium - Uprising: Levity Games Meeple Sticker Upgrade Kit, Dune: Imperium (Rise of Ix + Immortality) - The GiftForge Insert",0,32.40,0,0,"368867, 343598",Strategy Games,"Books: Dune, Game: Dune: Imperium, Misc: LongPack Games, Misc: Watch It Played How To Videos, Players: Games with Solitaire Rules",11.90,"Diuna: Imperium - Potęga Ix, Duna: Imperium - Ascensão de Ix, Duna: Impérium - Vzestup Iksu, Dűne: Impérium - Az Ix felemelkedése, Dune: Imperium - El Auge de Ix, Dune: Imperium - L'Ascesa di Ix, Dune: Imperium - L'Avènement d'Ix, Дюна: Империя - Расцвет иксианцев, Дюна: Імперіум - Розквіт Ікса, 듄 임페리움 확장: 익스의 부상",,,,,,,,
12333,Twilight Struggle,Ananda Gupta,GMT Games,Viktor Csete,2005,2,2,180,120,180,13,50309,8.24,8.05,14,2,10287,4021,3.61,1.58,0,70804,1091,1304,12657,,C:\Users\thoma\Downloads\bgg1toolu\img\012333.jpg,"Modern Warfare, Political, Wargame","Action / Event, Advantage Token, Area Majority / Influence, Campaign / Battle Card Driven, Dice Rolling, Events, Hand Management, Simulation, Simultaneous Action Selection, Sudden Death Ending, Tug of War, Variable Set-up",,N,B,N,N,N,N,N,N,N,N,N,N,N,N,N,N,N,N,N,N,"Now the trumpet summons us again, not as a call to bear arms, though arms we need; not as a call to battle, though embattled we are - but a call to bear the burden of a long twilight struggle. - John F. KennedyIn 1945, unlikely allies toppled Hitler's war machine, while humanity's most devastating weapons forced the Japanese Empire to its knees in a storm of fire. Where once there stood many great powers, there then stood only two. The world had scant months to sigh its collective relief before a new confli...",N,0,,,,,,,,429152,Twilight Struggle: 20th Anniversary Hall of Fame Edition,"300192, 383492, 300192, 383492","Twilight Struggle: Red Sea - Conflict in the Horn of Africa, Twilight Struggle: South Asian Monsoon, Twilight Struggle: Red Sea - Conflict in the Horn of Africa, Twilight Struggle: South Asian Monsoon","443307, 138423, 138421, 316245, 292393, 348661","Twilight Struggle: Boardpia Playbit, Twilight Struggle: Deluxe Countersheet, Twilight Struggle: Deluxe Mounted Mapboard, Twilight Struggle: GeekUp Bit Set, Twilight Struggle: Meeple Realty Insert, Twilight Struggle: The GiftForge Insert",0,46.42,0,0,"117145, 227688, 151546, 123262, 280500, 327916, 190581, 199869, 419703, 163247, 224686","Strategy Games, Wargames","Components: Map (Global Scale), Components: Multi-Use Cards, Continents: Asia, Country: Soviet Union, Country: USA, Digital Implementations: Google Play, Digital Implementations: Steam, Game: Twilight Struggle, History: Cold War, Misc: BGG Hall of Fame, Misc: Dice Tower Hall of Fame, Players: Two-Player Only Games, Players: Wargames with Rules Supporting Only Two Players, Political: NATO, Region: The World, Series: Twilight Struggle, Theme: Nuclear option, War Level of Command: Grand Strategy",14.29,"Gleichgewicht des Schreckens, Studená válka 1945-1989, Twilight Struggle: The Cold War, 1945-1989, Twilight Struggle: Zimna wojna 1945-1989, Zimna wojna 1945-1989, Сумеречная борьба, トワイライト・ストラグル, 冷战热斗 (冷戰熱鬥), 晨昏对峙（晨昏對峙）, 황혼의 투쟁",,,,,,,,
182028,Through the Ages: A New Story of Civilization,Vlaada Chvátil,Czech Games Edition,Filip Murmak,2015,2,4,120,120,120,14,33133,8.27,8.04,15,0,4915,1649,4.44,1.52,0,38380,547,951,9776,,C:\Users\thoma\Downloads\bgg1toolu\img\182028.jpg,"Card Game, Civilization, Economic","Action Points, Auction / Bidding, Auction: Dutch, Events, Income, Open Drafting, Player Elimination, Tags, Take That",,N,R,B,R,N,N,N,N,N,N,N,N,N,N,N,N,N,N,N,N,"Through the Ages: A New Story of Civilization is the new edition of Through the Ages: A Story of Civilization, with many changes small and large to the game's cards over its three ages and extensive changes to how military works.Through the Ages (TTA) is a civilization building game. Each player attempts to build the best civilization through careful resource management, and by: discovering new technologies, electing competent leaders, building wonders and maintaining a strong military. Weakness in any area...",N,0,,25613,Through the Ages: A Story of Civilization,,,,,,,,,"334015, 334123, 324638, 196016, 309596, 352064","Through the Ages: A New Story of Civilization - Folded Space Insert, Through the Ages: Laserox Organizer, Cywilizacja: Poprzez Wieki - Geekmod Organizer, Through the Ages: A New Story of Civilization - Acrylic Overlay, Through the Ages: A New Story of Civilization - e-Raptor Mini Organizer, Through the Ages: A New Story of Civilization - The Broken Token Organizer",0,32.73,0,0,280833,Strategy Games,"Digital Implementations: Board Game Arena, Digital Implementations: Google Play, Digital Implementations: Steam, Game: Through the Ages, Historical Figures: Various, Mechanism: Tableau Building, Misc: BGG Hall of Fame, Theme: Colonial",13.99,"Cywilizacja: Poprzez Wieki, Im Wandel der Zeitalter: Ein neue Geschichte der Zivilisation, Korokon át: A civilizáció új története, Through the Ages, Through the Ages: Eine neue Geschichte der Zivilisation, Through the Ages: L'Histoire vous appartient, Through the Ages: Nový příběh civilizace, Through the Ages: Rivivi la Storia della Civiltà, Through the Ages: Uma Nova História da Civilização, Through the Ages: Una Nueva Historia de la Civilización, Крізь епохи: Нова історія цивілізації, Сквозь Века. Новая История Цивилизации, דרך העידנים, スルー･ジ･エイジズ:新たなる文明の物語, 历史巨轮：人类文明新篇章, 쓰루 디 에이지스: 문명에 관한 새로운 이야기, 쓰루 디 에이지스: 새로운 인류 문명 발전 대서사시",,,,,,,,
84876,The Castles of Burgundy,Stefan Feld,alea,Julien Delval,2011,2,4,90,30,90,12,65474,8.15,8.02,16,0,10010,3016,2.97,1.25,0,80421,927,1100,13130,,C:\Users\thoma\Downloads\bgg1toolu\img\084876.jpg,"Animals, Dice, Medieval, Territory Building","Delayed Purchase, Dice Rolling, End Game Bonuses, Grid Coverage, Hexagon Grid, Open Drafting, Pattern Building, Tile Placement, Turn Order: Stat-Based, Variable Set-up",,N,B,R,R,N,N,N,N,N,N,N,N,N,N,N,N,N,N,N,N,"For the 2019 edition see The Castles of Burgundy.The game is set in the Burgundy region of High Medieval France. Each player takes on the role of an aristocrat, originally controlling a small princedom. While playing they aim to build settlements and powerful castles, practice trade along the river, exploit silver mines, and use the knowledge of travelers.The game is about players taking settlement tiles from the game board and placing them into their princedom which is represented by the player board. Ever...",N,0,,,,"191977, 232988, 433382","The Castles of Burgundy: The Card Game, The Castles of Burgundy: The Dice Game, The Sandcastles of Burgundy",,,"271320, 363622","The Castles of Burgundy, The Castles of Burgundy: Special Edition",,,"273035, 315061, 306391, 326373, 241127, 271939, 272500, 270740, 348624","The Castles of Burgundy: Basically Wooden Organiser, The Castles of Burgundy: Deluxe Token Bundle, The Castles of Burgundy: Folded Space Insert, The Castles of Burgundy: Folded Space Insert (Second edition), The Castles of Burgundy: GeekUp Bag Set, The Castles of Burgundy: Insert Here Insert, The Castles of Burgundy: Meeple Realty Insert, The Castles of Burgundy: Quick-Start Insert, The Castles of Burgundy: The GiftForge Insert",0,22.34,0,0,"178656, 231506, 256951, 264104, 110926, 132477, 139160, 150083, 166589, 190225, 193585, 214005, 234163, 179205",Strategy Games,"Animals: Cattle / Cows, Animals: Chickens / Roosters, Animals: Pigs, Animals: Sheep, Country: France, Digital Implementations: Board Game Arena, Digital Implementations: Boiteajeux, Digital Implementations: Google Play, Digital Implementations: Steam, Digital Implementations: Yucata, Game: The Castles of Burgundy, Mechanism: Tableau Building, Misc: BGG Hall of Fame, Misc: Dice Tower Hall of Fame, Misc: Watch It Played How To Videos, Players: Games with expansions that add solo play, Region: Burgundy (France), Series: Alea Big Box",11.37,"Die Burgen von Burgund, I Castelli della Borgogna, Los Castillos de Borgoña, Les Châteaux de Bourgogne, Zamki Burgundii, Замки Бургундии, ブルゴーニュ, ブルゴーニュの城, 勃根地城堡, 버건디의 성",,,,,,,,
202174,Viticulture: Tuscany Essential Edition,Jamey Stegmaier,Stonemaier Games,Beth Sobel,2016,1,6,150,60,150,14,10964,8.54,8.00,0,0,1842,285,3.26,1.08,0,30767,167,287,1939,,C:\Users\thoma\Downloads\bgg1toolu\img\202174.jpg,"Expansion for Base-game, Farming","Advantage Token, Race, Variable Player Powers, Worker Placement",,R,R,R,B,R,R,N,N,N,N,N,N,N,N,N,N,N,N,N,N,"Tuscany Essential Edition is an expansion for Viticulture which features the three most popular expansion modules from the original Tuscany expansion:      Extended Board: New game board featuring four full seasons for worker placement.     Structure Cards: New cards that players can build to supplement their existing structure figures.     Special Workers: New workers with their own special abilities, which players can train.All other expansions from the original Tuscany expansion will go out of print.Tusc...",Y,"128621, 183394","Viticulture, Viticulture Essential Edition",147101,Viticulture: Tuscany,,,140045,Viticulture: Kickstarter Promotional Cards,,,,,"268179, 263218, 267467, 348620, 337695, 343461, 367360","Tuscany: 14 Painted Character Meeples, Viticulture / Tuscany: 51 Painted Character Meeples, Viticulture Essential Edition: Folded Space Insert, Viticulture Essential Edition: The GiftForge Insert, Viticulture: reDrewno Insert, Viticulture: Shipshape Gamer Organizer, Viticulture: Wine Crate",0,23.26,0,0,"256549, 214463, 130655",Strategy Games,"Digital Implementations: Tabletopia, Game: Viticulture, Misc: Watch It Played How To Videos, Organizations: Automa Factory, Region: Tuscany (Italy)",12.40,"Vinohrad: Toskánsko, Viticultura: Toscana Editia Revizuita, Viticulture: Toscane Edition Essentielle, Viticulture: Toskania, Viticulture: Toszkána Esszenciális kiadás, Viticulture: Tuscany Edição Essencial, Viticulture: Tuscany Edición Esencial, Виноробство. Тоскана. Основне видання, ワイナリーの四季　拡張　トスカーナ, 葡萄酒莊園:托斯卡納, 비티컬처: 투스카니 에센셜 에디션",,,,,,,,
193738,Great Western Trail,Alexander Pfister,eggertspiele,Andreas Resch,2016,2,4,150,75,150,12,42309,8.17,8.00,17,0,5418,1640,3.70,1.32,0,45971,634,1133,9978,,C:\Users\thoma\Downloads\bgg1toolu\img\193738.jpg,"American West, Animals, Economic","Deck, Bag, and Pool Building, Hand Management, Ownership, Set Collection, Track Movement, Variable Set-up",,N,R,B,R,N,N,N,N,N,N,N,N,N,N,N,N,N,N,N,N,"America in the 19th century: You are a rancher and repeatedly herd your cattle from Texas to Kansas City, where you send them off by train. This earns you money and victory points. Needless to say, each time you arrive in Kansas City, you want to have your most valuable cattle in tow. However, the ""Great Western Trail"" not only requires that you keep your herd in good shape, but also that you wisely use the various buildings along the trail. Also, it might be a good idea to hire capable staff: cowboys...",N,0,,,,"431305, 341169","Great Western Trail: El Paso, Great Western Trail: Second Edition",,,,,,,"380322, 328776, 243360, 309434, 309604, 267350, 334746, 366935, 326824, 369237, 216277, 232365, 380324, 366936, 334736, 334747, 382561, 268418, 348638","Great Western Trail: BoardGameBoost Overlay, Great Western Trail: Coin-Cases, Great Western Trail: Drawstring Bags, Great Western Trail: e-Raptor Insert, Great Western Trail: e-Raptor Organizer, Great Western Trail: Folded Space Insert, Great Western Trail: Kolej na Północ - reDrewno Overlay, Great Western Trail: Laserox Overlay, Great Western Trail: Laserox Western Vault insert, Great Western Trail: Moedas & Co. Metal Coins, Great Western Trail: Player Mat Overlay, Great Western Trail: Player Overlay with Backing Board, Great Western Trail: Rails to the North - BoardGameBoost Overlay w/Backboard, Great Western Trail: Rails to the North - Laserox Overlay, Great Western Trail: reDrewno Insert, Great Western Trail: reDrewno Overlay, Great Western Trail: Sloyca Insert, Great Western Trail: The Game Doctors Insert, Great Western Trail: The GiftForge Insert",0,43.34,0,0,"256951, 232298, 295953, 264228, 225704, 245744, 238620, 293240",Strategy Games,"Animals: Cattle / Cows, Cities: Kansas City (Missouri, USA), Components: Control Boards, Components: Map (Regional scale), Components: Wooden pieces & boards, Country: USA, Digital Implementations: Board Game Arena, Game: Great Western Trail, Mechanism: Tableau Building, Series: The Great Designers (Stronghold Games), States: Texas",12.51,"Great Western, Great Western Trail: Aventură prin Vestul Sălbatic, Great Western Trail: La Gran Ruta del Oeste, A nagy western utazás, Великий западный путь, グレート ウエスタン トレイル, 大西部之路, 大西鐵路, 그레이트 웨스턴 트레일",,,,,,,,
246900,Eclipse: Second Dawn for the Galaxy,Touko Tahkokallio,Lautapelit.fi,Noah Adelman,2020,2,6,200,60,200,14,15344,8.42,7.97,18,0,2132,544,3.64,1.38,0,19945,110,951,8390,,C:\Users\thoma\Downloads\bgg1toolu\img\246900.jpg,"Civilization, Exploration, Science Fiction, Space Exploration, Wargame","Alliances, Area Majority / Influence, Area-Impulse, Dice Rolling, Grid Movement, Hexagon Grid, Hot Potato, Income, Modular Board, Passed Action Token, Tech Trees / Tech Tracks, Variable Player Powers",,N,R,R,B,R,B,N,N,N,N,N,N,N,N,N,N,N,N,N,N,"A game of Eclipse places you in control of a vast interstellar civilization, competing for success with its rivals. You explore new star systems, research technologies, and build spaceships with which to wage war. There are many potential paths to victory, so you need to plan your strategy according to the strengths and weaknesses of your species, while paying attention to the other civilizations' endeavors.Eclipse: Second Dawn for the Galaxy is a revised and upgraded version of the Eclipse base game that d...",N,0,,72125,Eclipse: New Dawn for the Galaxy,,,,,,,,,"372683, 305956, 376908, 376909, 305957, 305952","Eclipse: GeekUp Bit Set, Eclipse: Second Dawn for the Galaxy - Extra Dice, Eclipse: Second Dawn for the Galaxy - Reference Sheets, Eclipse: Second Dawn for the Galaxy - Scoring Pad, Eclipse: Second Dawn for the Galaxy - Ship Stands, Eclipse: Second Dawn for the Galaxy - Terran Ships",0,182.77,0,0,"356743, 381603, 305954, 375216, 305950, 368378, 366202, 305955, 368377, 294546, 350921, 381605, 303298",Strategy Games,"Components: Control Boards, Components: Game Trayz Inside, Components: Map (Interplanetary or Interstellar scale), Components: Miniatures, Crowdfunding: Kickstarter, Digital Implementations: Steam, Game: Eclipse (Lautapelit.fi), Mechanism: 4X, Misc: Made by Panda",12.05,"Eclipse: Das zweite galaktische Zeitalter, Eclipse: Drugi Świt Galaktyki, Eclipse: El Segundo Amanecer de la Galaxia, Eclipse: o Segundo Despertar da Galáxia, Eclipse. Второй рассвет галактики, エクリプス〜新たなる銀河の夜明け〜, 星蚀：黎明重现, 이클립스: 두 번째 여명",,,,,,,,
169786,Scythe,Jamey Stegmaier,Stonemaier Games,Jakub Rozalski,2016,1,5,115,90,115,14,88161,8.12,7.97,19,0,12945,3423,3.45,1.45,0,120591,922,1815,25032,,C:\Users\thoma\Downloads\bgg1toolu\img\169786.jpg,"Economic, Fighting, Science Fiction, Territory Building","Area Majority / Influence, Card Play Conflict Resolution, Contracts, End Game Bonuses, Force Commitment, Grid Movement, Hexagon Grid, King of the Hill, Movement Points, Narrative Choice / Paragraph, Solo / Solitaire Game, Take That, Tech Trees / Tech Tracks, Variable Player Powers, Variable Set-up, Victory Points as a Resource, Zone of Control",,R,R,R,B,R,N,N,N,N,N,N,N,N,N,N,N,N,N,N,N,"It is a time of unrest in 1920s Europa. The ashes from the first great war still darken the snow. The capitalistic city-state known simply as ""The Factory"", which fueled the war with heavily armored mechs, has closed its doors, drawing the attention of several nearby countries.Scythe is an engine-building game set in a 1920s era, alternate-history. It is a time of farming and war, broken hearts and rusted gears, innovation and valor. In Scythe, each player controls one of five factions of Eastern Euro...",N,0,,,,226320,My Little Scythe,,,,,,,"334656, 334654, 439303, 394548, 394547, 206690, 223406, 333426, 207791, 263803, 317056, 297611, 309473, 242715, 226917, 361379, 207629, 232123, 401524, 267461, 282766, 420128, 216398, 242714, 427383, 334019, 335250, 235883, 389996, 320029, 279496, 268239, 211947, 263346, 266152, 216392, 231641, 257269, 257270, 214599, 216391, 238417, 330823, 264324, 378775, 268417, 348650, 260687, 420129, 267172, 243232","Scythe: Legendary Box - reDrewno Insert, Scythe: reDrewno Insert, Expeditions/Scythe: $2 and $50 Metal Coins, Expeditions/Scythe: Red $5 Metal Coins, Scythe & Expeditions Metal Coins, Scythe: Action Tokens, Scythe: Automa Deck, Scythe: BGExpansions Faction Token Set, Scythe: Board Extension, Scythe: Broken Token Organizer, Scythe: Complete Rulebook, Scythe: Custom Enlistment Tokens, Scythe: e-Raptor Insert, Scythe: Encounter and Expansion Tokens, Scythe: Encounter Campfire Tokens, Scythe: Encounter Token Promo Coin, Scythe: Encounter Tokens, Scythe: Faction Boxes, Scythe: Feldherr insert, Scythe: Folded Space Insert, Scythe: GeekUp Bag Set, Scythe: Invaders from Afar - Feldherr Inlay, Scythe: Invaders from Afar - Promo Pack #8: Power dials, Scythe: Large Action Tokens, Scythe: Laserox Scythe Modular Board, Scythe: Laserox Scythe Silo Organizer, Scythe: lbStudiosOnEtsy Faction Buildings Custom Meeples, Scythe: Legendary Box, Scythe: Legendary Box - Kalkared Insert, Scythe: Legendary Box - Tower Rex Organizer, Scythe: Legendary Box - WarBox Organizer, Scythe: Legendary Organizer - Broken Token Insert, Scythe: Metal Coins, Scythe: Metal Mechs, Scythe: Neoprene Playmat, Scythe: Promo Pack #10 - $2 Albion Metal Coins, Scythe: Promo Pack #15 - $10 Nordic Metal Coins, Scythe: Promo Pack #16 - $1 Metal Coins, Scythe: Promo Pack #17 - $5 Rusviet Metal Coins, Scythe: Promo Pack #5 - Original Faction Power Dials, Scythe: Promo Pack #9 - $50 Metal Coins, Scythe: Realistic Resource Tokens, Scythe: ScytheKick, Scythe: Silicon Base Snaps, Scythe: Spielmaterial.de Updgrade, Scythe: The Game Doctors Insert, Scythe: The GiftForge Insert, Scythe: The Rise of Fenris - Spoiler-Free Upgrade Kit, Scythe: The Wind Gambit - Feldherr Inlay, Scythe: Tower Rex Organizer, Scythe: Upgraded Worker Meeples",0,112.48,0,0,"276229, 262151, 199727, 279304, 211731, 221033, 232176, 232087, 237663, 205121, 211732, 211733, 212879, 204984, 242277, 223555",Strategy Games,"Category: Autonomous simulation, Category: Dized Tutorial, Components:  Meeples, Components: Control Boards, Components: Map (Continental / National scale), Components: Miniatures, Components: Wooden pieces & boards, Continents: Europe, Crowdfunding: Kickstarter, Decades: The 1920's, Digital Implementations: Board Game Arena, Digital Implementations: Google Play, Digital Implementations: Steam, Digital Implementations: TableTop Simulator Mod (TTS), Digital Implementations: Tabletopia, Game: Scythe, Mechanism: Tableau Building, Misc: Made by Panda, Misc: Watch It Played How To Videos, Organizations: Automa Factory, Players: Games with Solitaire Rules, Theme: Alternate History, Theme: Dieselpunk, Theme: Mech Warfare",12.39,"Sçythe, Коса, Серп, 大鎌戦役, 鐮刀戰爭, 사이드, 사이쓰",,,,,,,,
