id,name,designer,publisher,artist,yearpublished,minplayers,maxplayers,playingtime,minplaytime,maxplaytime,age,usersrated,average,bayesaverage,rank,rank_wg,numcomments,numweights,averageweight,stddev,median,owned,trading,wanting,wishing,userrating,image,category,mechanic,comment,1player,2player,3player,4player,5player,6player,7player,8player,9player,10player,11player,12player,13player,14player,15player,16player,17player,18player,19player,20player,description,exp,basegame,basegame_name,reimplement,reimplement_name,reimplemented,reimplemented_name,contains,contains_name,iscontained,iscontained_name,integration,integration_name,accessories,accessories_name,numplays,price,userweight,wishpriority,expansions,domain,family,age_poll,name_others,comments_GL,thumbs_GL,sold_GL,price_GL,currency_GL,user_GL,tags,tags_user
247030,Terraforming Mars: Prelude,Jacob Fryxelius,FryxGames,William Bricker,2018,1,5,120,90,120,12,16330,8.85,8.41,0,0,2677,220,2.54,1.09,0,49411,195,206,1837,,C:\Users\thoma\Downloads\bgg1toolu\img\247030.jpg,"Expansion for Base-game, Economic, Environmental, Industry / Manufacturing, Science Fiction","Hand Management, Open Drafting, Tile Placement",,R,R,B,R,R,N,N,N,N,N,N,N,N,N,N,N,N,N,N,N,"As the mega corporations are getting ready to start the terraforming process, you now have the chance to make those early choices that will come to define your corporation and set the course for the future history of Mars - this is the prelude to your greatest endeavors!Terraforming Mars: Prelude introduces the new Prelude cards. At the start of the game, each player chooses from Prelude cards that jumpstart the terraforming process or boost their corporation's engine. This expansion also includes 5 new cor...",Y,167791,Terraforming Mars,,,,,,,,,,,"334522, 263156, 263728, 326364, 271967, 326742, 373842, 348608, 426252","Terraformacja Marsa: reDrewno Insert, Terraforming Mars: e-Raptor Insert, Terraforming Mars: Folded Space Insert, Terraforming Mars: Folded Space Insert (Second edition), Terraforming Mars: Insert Here Insert, Terraforming Mars: Laserox Terraformer's Toolbox Insert, Terraforming Mars: Spike Craft Insert, Terraforming Mars: The GiftForge Insert, Terraforming Mars: Upended Games Organizer",0,18.50,0,0,"427367, 370074, 375783, 427696, 427697, 377179, 364339, 358525, 427693",Strategy Games,"Digital Implementations: Board Game Arena, Game: Terraforming Mars, Players: Games with Solitaire Rules, Series: Terraforming Mars, Setting: Future Timeline (Fryxgames), Space: Earth's Solar System, Space: Mars, Space: Venus",11.89,"A Mars Terraformálása: A kezdetek, Mars: Teraformace - Předehra, Teraformiranje Marsa: Preludijum, Terraformacja Marsa: Preludium, Terraforming Mars: Präludium, Terraforming Mars: Prélude, Terraforming Mars: Prelúdio, Terraforming Mars: Preludio, Покорение Марса. Пролог, Тераформування Марса: Початок, ภาคเสริมพลิกภิภพดาวอังคาร: ปฐมบท, テラフォーミング・マーズ：拡張 プレリュード, 重塑火星：序幕, 테라포밍 마스 확장: 서곡",,,,,,,,
224517,Brass: Birmingham,Gavan Brown,Roxley,Gavan Brown,2018,2,4,120,60,120,14,51376,8.58,8.40,1,0,7074,2485,3.87,1.42,0,72820,261,1751,19712,,C:\Users\thoma\Downloads\bgg1toolu\img\224517.jpg,"Age of Reason, Economic, Industry / Manufacturing, Post-Napoleonic, Trains, Transportation","Hand Management, Income, Loans, Market, Network and Route Building, Tags, Tech Trees / Tech Tracks, Turn Order: Stat-Based, Variable Set-up",,N,R,B,B,N,N,N,N,N,N,N,N,N,N,N,N,N,N,N,N,"Brass: Birmingham is an economic strategy game sequel to Martin Wallace's 2007 masterpiece, Brass. Brass: Birmingham tells the story of competing entrepreneurs in Birmingham during the industrial revolution between the years of 1770 and 1870.It offers a very different story arc and experience from its predecessor. As in its predecessor, you must develop, build and establish your industries and network in an effort to exploit low or high market demands. The game is played over two halves: the canal era (year...",N,0,,28720,Brass: Lancashire,,,,,,,,,"334571, 399634, 439465, 309493, 347407, 419962, 430615, 339385, 420437, 373838, 350761, 348604, 432279, 340345, 428779, 347851, 306354, 328775, 349935, 268234, 233281","Brass: Birmingham / Lancashire - reDrewno Insert, Brass: Birmingham - BGExpansions Upgrade Kit, Brass: Birmingham - Česká pravidla a nápovědy, Brass: Birmingham - e-Raptor Insert, Brass: Birmingham - Game Tamer Organizer, Brass: Birmingham - Inserty Herman Insert, Brass: Birmingham - Iron Clays Upgrade, Brass: Birmingham - Laserox Organizer, Brass: Birmingham - Playmat, Brass: Birmingham - Spike Craft Insert, Brass: Birmingham - The Dicetroyers Organizer, Brass: Birmingham - The GiftForge Insert, Brass: Birmingham - Tokens Garden Metal Coins, Brass: Birmingham - TowerRex Organizer, Brass: Birmingham - Upended Games Organizer, Brass: Birmingham / Lancashire - Eurohell Design Insert, Brass: Birmingham / Lancashire - Folded Space Insert, Brass: Coin-Cases, Brass: Eurohell Design 3D Locomotive & Barge Upgrade, Brass: Meeple Realty Insert, Iron Clays",0,78.12,0,0,,Strategy Games,"Cities: Birmingham (England), Components: Map (Regional scale), Components: Multi-Use Cards, Country: England, Crowdfunding: Kickstarter, Crowdfunding: Spieleschmiede, Digital Implementations: Steam, Digital Implementations: Tabletopia, Digital Implementations: VASSAL, Food & Drink: Beer, Game: Brass, History: Industrial Revolution, Misc: LongPack Games, Misc: Watch It Played How To Videos, Occupation: Engineer, Organizations: The Game Artisans of Canada, Theme: Canals",13.35,"Brass. Бирмингем, Brass. Бірмінгем, ブラス：バーミンガム, 工业革命：伯明翰(Chinese edition) (2018), 工業革命：伯明翰, 브라스: 버밍엄",,,,,,,,
363622,The Castles of Burgundy: Special Edition,Stefan Feld,alea,Jakub Dzikowski,2023,1,4,120,70,120,12,8715,9.16,8.37,0,0,1560,224,2.84,0.97,0,20049,30,319,2753,,C:\Users\thoma\Downloads\bgg1toolu\img\363622.jpg,"Dice, Medieval, Territory Building","Dice Rolling, End Game Bonuses, Grid Movement, Set Collection, Solo / Solitaire Game, Team-Based Game, Tile Placement",,R,B,R,R,N,N,N,N,N,N,N,N,N,N,N,N,N,N,N,N,"Castles of Burgundy is a legendary Board Game design created by Stefan Feld. In this 1-4 players tabletop experience, you will take on the role of an aristocrat controlling a small princedom. Trying to build a settlement with powerful castles, practice trades, exploit silver mines, and use the knowledge of travelers.Now, this timeless game is coming back with an extremely polished, high-end special edition resulting from a collaboration between Ravensburger and Awaken Realms.In this special edition, you can...",N,0,,,,,,"84876, 264104, 110926, 132477, 139160, 150083, 166589, 190225, 193585, 214005, 234163","The Castles of Burgundy, The Castles of Burgundy: 10th Expansion - Solo, The Castles of Burgundy: 1st Expansion - New Player Boards, The Castles of Burgundy: 2nd Expansion - New Hex Tiles, The Castles of Burgundy: 3rd Expansion - German Board Game Championship Board 2013, The Castles of Burgundy: 4th Expansion - Monastery Boards, The Castles of Burgundy: 5th Expansion - Pleasure Garden, The Castles of Burgundy: 6th Expansion - The Cloisters, The Castles of Burgundy: 7th Expansion - German Board Game Championship Board 2016, The Castles of Burgundy: 8th Expansion - Trade Routes, The Castles of Burgundy: 9th Expansion - The Team Game",,,,,"367780, 367779, 373669, 426899, 364793, 419781","The Castles of Burgundy: Special Edition - 3D Terrain Pack, The Castles of Burgundy: Special Edition - Acrylic Hexes, The Castles of Burgundy: Special Edition - Acrylic Tiles, The Castles of Burgundy: Special Edition - Agon Spiele tray for acrylic tokens, The Castles of Burgundy: Special Edition - Playmat, The Castles of Burgundy: Special Edition - Tame My Games Organizer",0,187.84,0,0,,Strategy Games,"Animals: Cattle / Cows, Animals: Chickens / Roosters, Animals: Pigs, Animals: Sheep, Country: France, Crowdfunding: Gamefound, Game: The Castles of Burgundy, Mechanism: Tableau Building, Region: Burgundy (France), Versions & Editions: Big Box Versions of Individual Games",10.74,"Zamki Burgundii: Edycja Specjalna, 勃艮第城堡：特别典藏版",,,,,,,,
161936,Pandemic Legacy: Season 1,Rob Daviau,Z-Man Games,Chris Quilliams,2015,2,4,60,60,60,13,55362,8.52,8.37,2,0,8281,1504,2.83,1.60,0,86399,500,795,14297,,C:\Users\thoma\Downloads\bgg1toolu\img\161936.png,"Environmental, Medical","Action Points, Cooperative Game, Hand Management, Legacy Game, Multi-Use Cards, Point to Point Movement, Scenario / Mission / Campaign Game, Set Collection, Tags, Trading, Variable Player Powers",,N,R,R,B,N,N,N,N,N,N,N,N,N,N,N,N,N,N,N,N,"Pandemic Legacy is a co-operative campaign game, with an overarching story arc played through 12-24 sessions, depending on how well your group does at the game. At the beginning, the game starts in a very similar fashion as basic Pandemic, in which your team of disease-fighting specialists races against the clock to travel around the world, treating disease hot spots while researching cures for each of four plagues before they get out of hand.During a player's turn, they have four actions available, with wh...",N,0,,30549,Pandemic,221107,Pandemic Legacy: Season 2,,,,,,,309464,Pandemic Legacy: Season 1 & 2 - e-Raptor Insert,0,36.78,0,0,,"Strategy Games, Thematic Games","Components: Map (Global Scale), Components: Multi-Use Cards, Game: Pandemic, Mechanism: Campaign Games, Mechanism: Legacy, Medical: Diseases, Misc: Limited Replayability, Misc: Made by Panda, Occupation: Dispatcher, Occupation: Medic / Doctor / Nurses, Occupation: Researcher / Scientist, Region: The World, Theme: Science, Versions & Editions: Legacy Versions of Non-Legacy Games",11.32,"Pandemic Legacy:  Saison 1, Pandemic Legacy: 1. Évad, Pandemic Legacy: 1a. Temporada, Pandemic Legacy: Rok 1, Pandemic Legacy: Seizoen 1, Pandemic Legacy: Sezon 1, Пандемия: Наследие, Пандемія Спадщина. Сезон 1, パンデミック：レガシー シーズン1, 瘟疫危機︰承傳, 팬데믹 레거시: 시즌 1",,,,,,,,
342942,Ark Nova,Mathias Wigge,Feuerland Spiele,Steffen Bieker,2021,1,4,150,90,150,14,51468,8.54,8.34,3,0,6817,2699,3.78,1.39,0,75475,375,1055,15390,,C:\Users\thoma\Downloads\bgg1toolu\img\342942.jpg,"Animals, Economic, Environmental","Action Queue, End Game Bonuses, Grid Coverage, Hand Management, Hexagon Grid, Income, Increase Value of Unchosen Resources, Open Drafting, Set Collection, Solo / Solitaire Game, Tags, Tile Placement, Variable Player Powers, Variable Set-up",,R,B,R,P,N,N,N,N,N,N,N,N,N,N,N,N,N,N,N,N,"In Ark Nova, you will plan and design a modern, scientifically managed zoo. With the ultimate goal of owning the most successful zoological establishment, you will build enclosures, accommodate animals, and support conservation projects all over the world. Specialists and unique buildings will help you in achieving this goal.Each player has a set of five action cards to manage their gameplay, and the power of an action is determined by the slot the card currently occupies. The cards in question are:    CARD...",N,0,,,,,,,,,,,,"433128, 366502, 365692, 413174, 375802, 357875, 366164, 375801, 360411, 419823, 419824, 419822, 367202, 426880, 434368, 368014, 382556, 378754, 367999, 367516","Ark Nova + Marine Worlds: Eurohell Design Insert, Ark Nova: BGExpansions Full Upgrade Kit, Ark Nova: Board Game Amplifier Acrylic Overlay, Ark Nova: e-Raptor Insert UV Print, Ark Nova: Eurohell Design Coffee Mug, Ark Nova: Eurohell Design Insert, Ark Nova: Eurohell Design Upgrade Coins, Ark Nova: Eurohell Design X-tokens, Ark Nova: Folded Space Insert, Ark Nova: LaserLand 112 Token Upgrades, Ark Nova: LaserLand Marine Worlds Association Board Overlay, Ark Nova: LaserLand Player Board Overlays, Ark Nova: Laserox Organizer, Ark Nova: Moedas & Co. Metal Coins, Ark Nova: Polandgames Token Set, Ark Nova: reDrewno Insert, Ark Nova: Sloyca Insert, Ark Nova: Spielmaterial.de Upgrade, Ark Nova: The GiftForge Insert, Ark Nova: Wooden tokens",0,49.19,0,0,"368966, 433207, 368158, 426978",Strategy Games,"Components: Hexagonal Tiles, Digital Implementations: Board Game Arena, Digital Implementations: Steam, Digital Implementations: TableTop Simulator Mod (TTS), Game: Ark Nova, Mechanism: Tableau Building, Players: Games with Solitaire Rules, Theme: Ecology, Theme: Science, Theme: Zoos, Aquaria, Safari Parks",12.76,"Archa Nova, Arche Nova, Новий ковчег, นาวาสรรพสัตว์, アーク・ノヴァ 新たなる方舟, 方舟动物园, 方舟動物園, 아크 노바",,,,,,,,
174430,Gloomhaven,Isaac Childres,Cephalofair Games,Alexandr Elichev,2017,1,4,120,60,120,14,64608,8.57,8.33,4,0,11270,2655,3.91,1.74,0,100726,1168,1172,21351,,C:\Users\thoma\Downloads\bgg1toolu\img\174430.jpg,"Adventure, Exploration, Fantasy, Fighting, Miniatures","Action Queue, Action Retrieval, Campaign / Battle Card Driven, Card Play Conflict Resolution, Communication Limits, Cooperative Game, Critical Hits and Failures, Deck Construction, Grid Movement, Hand Management, Hexagon Grid, Legacy Game, Line of Sight, Modular Board, Multi-Use Cards, Narrative Choice / Paragraph, Once-Per-Game Abilities, Role Playing, Scenario / Mission / Campaign Game, Simultaneous Action Selection, Solo / Solitaire Game, Storytelling, Tags, Variable Player Powers",,R,R,B,R,N,N,N,N,N,N,N,N,N,N,N,N,N,N,N,N,"Gloomhaven  is a game of Euro-inspired tactical combat in a persistent world of shifting motives. Players will take on the roles of wandering adventurers with their own special sets of skills and their own reasons for traveling to this dark corner of the world. Players must work together out of necessity to clear out menacing dungeons and forgotten ruins. In the process, they will enhance their abilities with experience and loot, discover new locations to explore and plunder, and expand an ever-branching st...",N,0,,,,390478,Gloomhaven (Second Edition),,,,,"295770, 291457, 295770, 291457","Frosthaven, Gloomhaven: Jaws of the Lion, Frosthaven, Gloomhaven: Jaws of the Lion","334735, 418048, 289347, 306515, 289346, 289348, 289343, 306373, 288415, 289344, 306378, 306513, 289345, 289349, 288414, 289350, 288418, 288420, 306376, 289342, 306517, 306374, 287230, 288416, 306516, 287231, 287229, 306514, 288417, 272787, 272783, 275029, 280078, 272784, 393273, 282059, 308555, 261980, 367191, 365880, 336186, 272804, 367868, 250857, 261252, 306362, 418046, 293088, 250858, 366336, 273547, 338418, 348625, 365831, 365799, 267166, 265296","Gloomhaven: reDrewno Insert, Frosthaven/Gloomhaven: Laserox Vitality Dial Set, Gloomhaven: Adventure Tokens - Altar, Gloomhaven: Adventure Tokens - Barrel, Gloomhaven: Adventure Tokens - Bear Trap, Gloomhaven: Adventure Tokens - Bookcase, Gloomhaven: Adventure Tokens - Boulder, Gloomhaven: Adventure Tokens - Bush, Gloomhaven: Adventure Tokens - Cabinet, Gloomhaven: Adventure Tokens - Chest, Gloomhaven: Adventure Tokens - Crate, Gloomhaven: Adventure Tokens - Crystal, Gloomhaven: Adventure Tokens - Door, Gloomhaven: Adventure Tokens - Fountain, Gloomhaven: Adventure Tokens - Log, Gloomhaven: Adventure Tokens - Nest, Gloomhaven: Adventure Tokens - Poison Gas, Gloomhaven: Adventure Tokens - Pressure Plate, Gloomhaven: Adventure Tokens - Rock Column, Gloomhaven: Adventure Tokens - Rubble, Gloomhaven: Adventure Tokens - Sarcophagus, Gloomhaven: Adventure Tokens - Shelf, Gloomhaven: Adventure Tokens - Spike Pit, Gloomhaven: Adventure Tokens - Stairs, Gloomhaven: Adventure Tokens - Stone Pillar, Gloomhaven: Adventure Tokens - Stump, Gloomhaven: Adventure Tokens - Table, Gloomhaven: Adventure Tokens - Totem, Gloomhaven: Adventure Tokens - Wall Section, Gloomhaven: Broken Token Character Trays, Gloomhaven: Broken Token Organizer, Gloomhaven: Broken Token Organizer - Extra Dividers, Gloomhaven: Broken Token Organizer - Forgotten Circles Upgrade, Gloomhaven: Broken Token Tuck Boxes, Gloomhaven: Challenge Coin, Gloomhaven: Crafting Kingdoms Playmats, Gloomhaven: E-Raptor Insert, Gloomhaven: Folded Space Insert, Gloomhaven: Forgotten Circles - Tower Rex Organizer, Gloomhaven: Forgotten Circles - Tower Rex Organizer Upgrade, Gloomhaven: Gaming Trunk Character's Tray, Gloomhaven: Gloom Tavern Organizer, Gloomhaven: Go7 Gaming Top Tray, Gloomhaven: HP/XP Trackers, Gloomhaven: Laserox GloomBox Organizer, Gloomhaven: Laserox Monster Bases, Gloomhaven: Laserox Sigil Set, Gloomhaven: Metal Coin Upgrade, Gloomhaven: Miniatures, Gloomhaven: Momo Monster Playmat, Gloomhaven: Player Mat, Gloomhaven: Saim Lab Insert, Gloomhaven: The GiftForge Insert, Gloomhaven: Tower Rex Character Dashboard, Gloomhaven: Tower Rex Dashboard, Gloomhaven: Tower Rex Organizer, Gloomhaven: WarBox Insert",0,125.85,0,0,"365186, 367749, 367751, 312632, 310777, 380753, 250337, 312635, 236232, 298195, 297586, 226868, 310773, 231934, 300402, 310754, 312638","Strategy Games, Thematic Games","Category: Dungeon Crawler, Components: Map (City Scale), Components: Miniatures, Components: Multi-Use Cards, Components: Standees, Creatures: Demons, Creatures: Dragons, Creatures: Monsters, Crowdfunding: Kickstarter, Digital Implementations: Steam, Digital Implementations: TableTop Simulator Mod (TTS), Game: Gloomhaven, Mechanism: Campaign Games, Mechanism: Legacy, Misc: Forteller Audio Narration, Misc: Made by Panda, Players: Games with Solitaire Rules",12.86,"Gloomhaven, aventures à Havrenuit, Gloomhaven: Мрачная Гавань, Homályrév, グルームヘイヴン, 幽港迷城, 글룸헤이븐",,,,,,,,
233078,Twilight Imperium: Fourth Edition,Dane Beltrami,Fantasy Flight Games,Scott Schomburg,2017,3,6,480,240,480,14,25820,8.58,8.23,5,0,3832,1258,4.33,1.64,0,31181,207,1059,12171,,C:\Users\thoma\Downloads\bgg1toolu\img\233078.jpg,"Civilization, Economic, Exploration, Negotiation, Political, Science Fiction, Space Exploration, Wargame","Action Drafting, Area-Impulse, Dice Rolling, Follow, Grid Movement, Hexagon Grid, Increase Value of Unchosen Resources, King of the Hill, Modular Board, Movement Points, Race, Tech Trees / Tech Tracks, Trading, Variable Phase Order, Variable Player Powers, Variable Set-up, Voting",,N,N,R,R,R,B,N,N,N,N,N,N,N,N,N,N,N,N,N,N,"Twilight Imperium (Fourth Edition) is a game of galactic conquest in which three to six players each take on the role of one of seventeen factions vying for galactic domination through military might, political maneuvering, and economic bargaining. Every faction offers a completely different play experience, from the wormhole-hopping Ghosts of Creuss to the Emirates of Hacan, masters of trade and economics. These seventeen races are offered many paths to victory, but only one may sit upon the throne of Meca...",N,0,,12493,Twilight Imperium: Third Edition,,,,,,,,,"332494, 306385, 262962, 309437, 267464, 243197, 297573, 297572, 306357, 306358, 306359, 365794, 376437, 347404, 401531, 440127, 326743, 376502, 402119","Twilight Imperium: Fourth Edition - reDrewno Insert, Twilight Imperium (Fourth Edition): Broken Token Board Frames, Twilight Imperium (Fourth Edition): Deluxe Rulebook, Twilight Imperium (Fourth Edition): e-Raptor Insert, Twilight Imperium (Fourth Edition): Folded Space Insert, Twilight Imperium (Fourth Edition): Galactic Gamemat, Twilight Imperium (Fourth Edition): Gamefit Fixators of the Field, Twilight Imperium (Fourth Edition): Gamefit Insert, Twilight Imperium (Fourth Edition): Laserox Command & Control Tokens, Twilight Imperium (Fourth Edition): Laserox Commodity & Trade Tokens, Twilight Imperium (Fourth Edition): Laserox Infantry & Fighter Tokens, Twilight Imperium (Fourth Edition): Tower Rex Organizer, Twilight Imperium: CMON Comics - Vol. 2 Promos, Twilight Imperium: Fourth Edition - Game Tamer Organizer, Twilight Imperium: Fourth Edition - Playmaty rubber mat, Twilight Imperium: Fourth Edition - The GiftForge Insert, Twilight Imperium: Laserox Twilight Treasury insert, Twilight Imperium: Prime Game Mat, Twilight Imperium: Speaker Pin Badge",0,104.38,0,0,"315895, 332157, 336970, 362201","Strategy Games, Thematic Games","Components: Hexagonal Tiles, Components: Map (Interplanetary or Interstellar scale), Components: Miniatures, Game: Twilight Imperium, Mechanism: 4X, Misc: Made by Panda",14.32,"Twilight Imperium: 4. kiadás, Twilight Imperium: Čtvrtá edice, Twilight Imperium: Cuarta Edición, Twilight Imperium: Quarta Edição, Twilight Imperium: Quarta Edizione, Twilight Imperium: Quatrième Édition, Twilight Imperium: Świt Nowej Ery, Twilight Imperium: Vierte Edition, Сумерки империи: Четвёртое издание, Сутінки імперії: Четверте видання, トワイライト・インぺリウム第4版, 帝国曙光 第4版, 여명의 제국",,,,,,,,
316554,Dune: Imperium,Paul Dennen,Dire Wolf,Clay Brooks,2020,1,4,120,60,120,14,51782,8.42,8.23,6,0,6800,1832,3.06,1.28,0,70207,450,1089,14434,,C:\Users\thoma\Downloads\bgg1toolu\img\316554.jpg,"Movies / TV / Radio theme, Novel-based, Political, Science Fiction","Card Play Conflict Resolution, Deck, Bag, and Pool Building, Delayed Purchase, Force Commitment, Increase Value of Unchosen Resources, Multi-Use Cards, Open Drafting, Race, Solo / Solitaire Game, Tags, Take That, Turn Order: Progressive, Variable Player Powers, Worker Placement",,R,R,B,B,N,N,N,N,N,N,N,N,N,N,N,N,N,N,N,N,"Dune: Imperium is a game that uses deck building to add a hidden information angle to traditional worker placement. It finds inspiration in elements and characters from the Dune legacy, both the new film from Legendary Pictures and the seminal literary series from Frank Herbert, Brian Herbert, and Kevin J. Anderson.As a leader of one of the Great Houses of the Landsraad, raise your banner and marshal your forces and spies. War is coming, and at the center of the conflict is Arrakis - Dune, the desert planet...",N,0,,,,,,,,,,"397598, 397598","Dune: Imperium - Uprising, Dune: Imperium - Uprising","358128, 382557, 425031, 399809, 428576, 324114, 379830, 387875, 411880, 373066, 362329, 347990, 429998, 367215, 367216, 368406, 401538, 429487, 439080, 368402, 364160, 364161, 390600, 428958, 383267","Diuna: Imperium - reDrewno Insert, Diuna: Imperium - Sloyca Insert, Dune: Imperium - Apexcrafter Metal Solari Coin Set, Dune: Imperium - BGExpansions Upgrade Kit, Dune: Imperium - Cinder & Ember Insert, Dune: Imperium - Deluxe Upgrade Pack, Dune: Imperium - Dreadnought Upgrade Pack, Dune: Imperium - Eurohell 3D Token coins, Dune: Imperium - Eurohell Design Inlay, Dune: Imperium - Folded Space Insert, Dune: Imperium - Go7 Insert, Dune: Imperium - GolonkoCrafts Premium Resources, Dune: Imperium - LaserLand Water & Spice Tokens, Dune: Imperium - Laserox deluxe organizer, Dune: Imperium - Laserox Organizer, Dune: Imperium - LevityGames Meeple Sticker Upgrade Kit, Dune: Imperium - Playmaty player's board mat, Dune: Imperium - Polandgames Acrylic Token Set, Dune: Imperium - Strata Strike Resource Set, Dune: Imperium - The Dicetroyers Organizer, Dune: Imperium - The GiftForge Insert, Dune: Imperium - The GiftForge player board, Dune: Imperium - The Mind Killer Playmat, Dune: Imperium - Uprising: Folded Space Insert, Dune: Imperium (Rise of Ix + Immortality) - The GiftForge Insert",0,47.64,0,0,"368867, 441634, 426129, 343598, 345692, 367466, 326431, 374597, 342031, 434489, 392622",Strategy Games,"Books: Dune, Components:  Meeples, Components: Multi-Use Cards, Digital Implementations: Google Play, Digital Implementations: Steam, Game: Dune: Imperium, Misc: LongPack Games, Misc: Watch It Played How To Videos, Players: Games with Solitaire Rules",12.05,"Dina: Imperijum, Diuna: Imperium, Duna: Imperium, Duna: Impérium, Dűne: Impérium, Дюна: Империя, Дюна: Імперіум, デューン 砂の惑星：インペリウム, 沙丘：帝国, 듄: 임페리움",,,,,,,,
